中文名,英文名,属性,第一细分类,第二细分类,成立年份,所在省份+城市（细）,官网,备注,官网（中国办公室）,LinkedIn（中国办公室）,中国办公室介绍（含文内引用）,参考文献（APA）
巴拿马华商总会广东办事处,Panama Chinese Merchants Association – Guangdong Office,非政府间组织（INGO）,金融体系、治理与发展融资,侨商网络-经贸合作,2021,广东清远,无,,暂无,暂无,"巴拿马华商总会广东办事处（Panama Chinese Merchants Association – Guangdong Office）成立于2021年。当前可核验来源以机构总部或权威组织资料为主，尚未稳定定位到独立的中国办公室官方主页 [1]。现有资料显示其业务或合作范围包括：Préparez votre voyage au Panama : incontournables et itinéraires, infos culturelles et pratiques, idées voyage, photos e。在补充来源中，其组织定位、项目方向或区域协作重点可概括为：Avec routard.com, toutes les informations Incontournables pour préparer votre voyage au Panama. Carte Panama, formalité, [2]。按源表登记，该机构关联地点为广东清远。","[1] Voyage Panama - Partir en vacances au Panama - Routard.com. (n.d.). Retrieved 2026-03-25, from https://www.routard.com/fr/guide/ameriques/panama
[2] Panama : les incontournables | Que faire, que voir, que visiter. (n.d.). Retrieved 2026-03-25, from https://www.routard.com/fr/guide/top/ameriques/panama"
世界自由贸易区联合会（美国）杭州代表处,"World Free Zones Organization (WFZO, USA) – Hangzhou Representative Office",非政府间组织（INGO）,国际法、仲裁与规则治理,自由贸易区-投资促进,2021,浙江杭州,无,,暂无,暂无,"世界自由贸易区联合会（美国）杭州代表处（World Free Zones Organization (WFZO, USA) – Hangzhou Representative Office）成立于2021年。当前可核验来源以机构总部或权威组织资料为主，尚未稳定定位到独立的中国办公室官方主页 [1]。现有资料显示其业务或合作范围包括：2026年1月23日 · The Annual Meeting 2026 of the World Economic Forum will take place at Davos-Klosters from 19th to 23rd Jan。在补充来源中，其组织定位、项目方向或区域协作重点可概括为：2025年4月24日 · Top international trade stories: Global trade set to decline in 2025, WTO says; Tariffs take centre stage a [2]。按源表登记，该机构关联地点为浙江杭州。","[1] World Economic Forum Annual Meeting. (n.d.). Retrieved 2026-03-25, from https://www.weforum.org/meetings/world-economic-forum-annual-meeting-2026/
[2] WTO sounds alarm on trade risks and other trade news | World …. (n.d.). Retrieved 2026-03-25, from https://www.weforum.org/stories/2025/04/global-trade-decline-2025-international-trade-stories-this-month/"
国际行动理事会（爱尔兰）北京代表处,International Action Council (Ireland) – Beijing Representative Office,非政府间组织（INGO）,公共政策、治理与能力建设,国际政策-对话合作,2021,北京,无,,暂无,暂无,国际行动理事会（爱尔兰）北京代表处（International Action Council (Ireland) – Beijing Representative Office）成立于2021年。该机构主要承担跨国协作、专业网络建设或行业标准交流等职能。目前未检索到可稳定核验的中国办公室官网链接，现阶段可先将其视为以总部体系为主导开展国际合作的组织。源表登记所在地为北京，可作为后续人工核验线索。,暂无
毛里求斯经济发展局上海代表处,Economic Development Board of Mauritius (EDB Mauritius) – Shanghai Representative Office,非政府间组织（INGO）,金融体系、治理与发展融资,投资促进-经贸合作,2021,上海,无,,暂无,暂无,"毛里求斯经济发展局上海代表处（Economic Development Board of Mauritius (EDB Mauritius) – Shanghai Representative Office）成立于2021年。当前可核验来源以机构总部或权威组织资料为主，尚未稳定定位到独立的中国办公室官方主页 [1]。现有资料显示其业务或合作范围包括：2025年8月5日 · 2025 has been marked by significant global shifts, including increased geopolitical instability, the acceler。在补充来源中，其组织定位、项目方向或区域协作重点可概括为：2022年5月19日 · GDP has been used as a measure of economic growth since 1937. But the need for wellbeing metrics is bringin [2]。按源表登记，该机构关联地点为上海。","[1] In charts: 7 global shifts defining 2025 so far | World Economic Forum. (n.d.). Retrieved 2026-03-25, from https://www.weforum.org/stories/2025/08/inflection-points-7-global-shifts-defining-2025-so-far-in-charts/
[2] GDP: What is it and why does it matter? - World Economic Forum. (n.d.). Retrieved 2026-03-25, from https://www.weforum.org/stories/2022/05/what-is-gdp-economic-growth-matters/"
美国加州葡萄干管理委员会上海代表处,California Raisin Administrative Committee (USA) – Shanghai Representative Office,非政府间组织（INGO）,农业、食品与乡村可持续发展,农产品推广-市场合作,2021,上海,无,,暂无,暂无,美国加州葡萄干管理委员会上海代表处（California Raisin Administrative Committee (USA) – Shanghai Representative Office）成立于2021年。当前可核验来源以机构总部或权威组织资料为主，尚未稳定定位到独立的中国办公室官方主页 [1]。现有资料显示其业务或合作范围包括：Object moved Object moved to here.。在补充来源中，其组织定位、项目方向或区域协作重点可概括为：Microsoft的技术问题和答案的家。 开始询问、回答和浏览有关 .Net、Azure 或 Teams 等产品的问题。 [2]。按源表登记，该机构关联地点为上海。,"[1] Object moved - answers.microsoft.com. (n.d.). Retrieved 2026-03-25, from https://answers.microsoft.com/en-us/windowslive/forum/email/how-can-i-stop-my-incoming-emails-from-being/7d10785c-f23d-4840-a49c-c33b0aa80da9
[2] Microsoft 问答 | Microsoft Learn. (n.d.). Retrieved 2026-03-25, from https://answers.microsoft.com/zh-hans/windowslive/forum/all/%E9%94%99%E8%BF%87msn-space/3fca7c94-9c46-49f4-bdd9-2ffe7aba2baf"
美国啤酒酿造商协会上海代表处,Beer Institute (USA) – Shanghai Representative Office,非政府间组织（INGO）,农业、食品与乡村可持续发展,酒类产业-行业协会,2021,上海,无,,暂无,暂无,美国啤酒酿造商协会上海代表处（Beer Institute (USA) – Shanghai Representative Office）成立于2021年。该机构主要承担跨国协作、专业网络建设或行业标准交流等职能。目前未检索到可稳定核验的中国办公室官网链接，现阶段可先将其视为以总部体系为主导开展国际合作的组织。源表登记所在地为上海，可作为后续人工核验线索。,暂无
美国威斯康辛州花旗参农业总会上海代表处,Wisconsin Ginseng Association (USA) – Shanghai Representative Office,非政府间组织（INGO）,农业、食品与乡村可持续发展,农产品推广-品牌营销,2021,上海,无,,暂无,暂无,美国威斯康辛州花旗参农业总会上海代表处（Wisconsin Ginseng Association (USA) – Shanghai Representative Office）成立于2021年。该机构主要承担跨国协作、专业网络建设或行业标准交流等职能。目前未检索到可稳定核验的中国办公室官网链接，现阶段可先将其视为以总部体系为主导开展国际合作的组织。源表登记所在地为上海，可作为后续人工核验线索。,暂无
美国稻米协会上海代表处,USA Rice – Shanghai Representative Office,非政府间组织（INGO）,农业、食品与乡村可持续发展,农产品贸易-市场推广,2021,上海,无,,暂无,暂无,美国稻米协会上海代表处（USA Rice – Shanghai Representative Office）成立于2021年。该机构主要承担跨国协作、专业网络建设或行业标准交流等职能。目前未检索到可稳定核验的中国办公室官网链接，现阶段可先将其视为以总部体系为主导开展国际合作的组织。源表登记所在地为上海，可作为后续人工核验线索。,暂无
美国马铃薯协会上海代表处,Potatoes USA – Shanghai Representative Office,非政府间组织（INGO）,农业、食品与乡村可持续发展,农产品推广-市场合作,2021,上海,无,,暂无,暂无,"美国马铃薯协会上海代表处（Potatoes USA – Shanghai Representative Office）成立于2021年。当前可核验来源以机构总部或权威组织资料为主，尚未稳定定位到独立的中国办公室官方主页 [1]。现有资料显示其业务或合作范围包括：Chips, mash, roasties, dauphinoise， potato is the kitchen gift that keeps on giving. Try one of our new recipe ideas for。在补充来源中，其组织定位、项目方向或区域协作重点可概括为：2025年3月7日 · From buttery Jersey Royals to King Edwards and Maris Pipers, discover the best types of potatoes to try. Plu [2]。按源表登记，该机构关联地点为上海。","[1] 43 Potato Recipe Ideas | Good Food. (n.d.). Retrieved 2026-03-25, from https://www.bbcgoodfood.com/recipes/collection/potato-recipes
[2] Types of Potatoes : a British Seasonal Guide | M&S Food. (n.d.). Retrieved 2026-03-25, from https://www.marksandspencer.com/food/content/types-of-potatoes?msockid=0b8c0d88d7126c063c731aafd67f6d6c"
美国乳品出口协会上海代表处,U.S. Dairy Export Council (USDEC) – Shanghai Representative Office,非政府间组织（INGO）,金融体系、治理与发展融资,乳品贸易-市场推广,2021,上海,无,,暂无,暂无,美国乳品出口协会上海代表处（U.S. Dairy Export Council (USDEC) – Shanghai Representative Office）成立于2021年。该机构主要承担跨国协作、专业网络建设或行业标准交流等职能。目前未检索到可稳定核验的中国办公室官网链接，现阶段可先将其视为以总部体系为主导开展国际合作的组织。源表登记所在地为上海，可作为后续人工核验线索。,暂无
柬埔寨国际商会浙江代表处,Cambodia International Chamber of Commerce – Zhejiang Representative Office,非政府间组织（INGO）,数字技术、信息治理与网络安全,商会服务-经贸合作,2021,浙江湖州,无,,暂无,暂无,柬埔寨国际商会浙江代表处（Cambodia International Chamber of Commerce – Zhejiang Representative Office）成立于2021年。该机构主要承担跨国协作、专业网络建设或行业标准交流等职能。目前未检索到可稳定核验的中国办公室官网链接，现阶段可先将其视为以总部体系为主导开展国际合作的组织。源表登记所在地为浙江湖州，可作为后续人工核验线索。,暂无
南非-中国跨境电商协会上海代表处,South Africa–China Cross-Border E-Commerce Association – Shanghai Representative Office,非政府间组织（INGO）,金融体系、治理与发展融资,跨境电商-贸易促进,2021,上海,无,,暂无,暂无,"南非-中国跨境电商协会上海代表处（South Africa–China Cross-Border E-Commerce Association – Shanghai Representative Office）成立于2021年。当前可核验来源以机构总部或权威组织资料为主，尚未稳定定位到独立的中国办公室官方主页 [1]。现有资料显示其业务或合作范围包括：South Wales Argus - the first place to look for news in Newport, Gwent and across South East Wales。按源表登记，该机构关联地点为上海。","[1] South Wales Argus - the first place to look for news in Newport and .... (n.d.). Retrieved 2026-03-25, from https://www.southwalesargus.co.uk/news/"
老挝国家工商会重庆代表处,Lao National Chamber of Commerce and Industry – Chongqing Representative Office,非政府间组织（INGO）,创新创业与科技转化,商会服务-经贸合作,2021,重庆,无,,暂无,暂无,"老挝国家工商会重庆代表处（Lao National Chamber of Commerce and Industry – Chongqing Representative Office）成立于2021年。当前可核验来源以机构总部或权威组织资料为主，尚未稳定定位到独立的中国办公室官方主页 [1]。现有资料显示其业务或合作范围包括：4 天之前 · The Lao People's Democratic Republic (Laos) is a developing country ruled by a one-party, Communist government. 。按源表登记，该机构关联地点为重庆。","[1] Where is Laos? Culture, Facts & Travel - CountryReports. (n.d.). Retrieved 2026-03-25, from https://www.countryreports.org/country/laos.htm"
法中经贸企业和科技创新促进会上海代表处,France–China Economic and Trade Enterprises & Science and Technology Innovation Promotion Association – Shanghai Representative Office,非政府间组织（INGO）,金融体系、治理与发展融资,经贸合作-科技创新,2021,上海,无,,暂无,暂无,"法中经贸企业和科技创新促进会上海代表处（France–China Economic and Trade Enterprises & Science and Technology Innovation Promotion Association – Shanghai Representative Office）成立于2021年。当前可核验来源以机构总部或权威组织资料为主，尚未稳定定位到独立的中国办公室官方主页 [1]。现有资料显示其业务或合作范围包括：In spring, France reveals one of its most beautiful sides. Outdoor cafés fill up, parks and gardens come into bloom, and。按源表登记，该机构关联地点为上海。","[1] France .fr : Explore France and its wonders - Explore France. (n.d.). Retrieved 2026-03-25, from https://www.france.fr/en/"
俄中商务中心（俄罗斯）上海代表处,Russia–China Business Center (Russia) – Shanghai Representative Office,非政府间组织（INGO）,金融体系、治理与发展融资,经贸合作-商务服务,2021,上海,无,,暂无,暂无,"俄中商务中心（俄罗斯）上海代表处（Russia–China Business Center (Russia) – Shanghai Representative Office）成立于2021年。当前可核验来源以机构总部或权威组织资料为主，尚未稳定定位到独立的中国办公室官方主页 [1]。现有资料显示其业务或合作范围包括：2017年4月22日 · After some searching, I'm still unsure about what function the soft sign (Ь) performs in Russian. I have re。按源表登记，该机构关联地点为上海。","[1] What is the function of the soft sign (Ь) in Russian?. (n.d.). Retrieved 2026-03-25, from https://linguistics.stackexchange.com/questions/22687/what-is-the-function-of-the-soft-sign-%d0%ac-in-russian"
欧盟广西总商会（德国）广西联络处,European Union Guangxi General Chamber of Commerce (Germany) – Guangxi Liaison Office,非政府间组织（INGO）,金融体系、治理与发展融资,商会服务-经贸合作,2021,广西南宁,无,,暂无,暂无,"欧盟广西总商会（德国）广西联络处（European Union Guangxi General Chamber of Commerce (Germany) – Guangxi Liaison Office）成立于2021年。当前可核验来源以机构总部或权威组织资料为主，尚未稳定定位到独立的中国办公室官方主页 [1]。现有资料显示其业务或合作范围包括：The European Union (EU) is a group of 27 nations in Europe, formed in the aftermath of World War II. The first batch of 。按源表登记，该机构关联地点为广西南宁。","[1] List of Countries in the European Union 2026 - World Population Review. (n.d.). Retrieved 2026-03-25, from https://worldpopulationreview.com/country-rankings/european-union-countries"
世界内镜医师协会（美国）北京代表处,World Endoscopy Doctors Association (USA) – Beijing Representative Office,非政府间组织（INGO）,医学与生命科学研究,医学学会-专业培训,2021,北京,无,,暂无,暂无,"世界内镜医师协会（美国）北京代表处（World Endoscopy Doctors Association (USA) – Beijing Representative Office）成立于2021年。当前可核验来源以机构总部或权威组织资料为主，尚未稳定定位到独立的中国办公室官方主页 [1]。现有资料显示其业务或合作范围包括：2026年1月23日 · The Annual Meeting 2026 of the World Economic Forum will take place at Davos-Klosters from 19th to 23rd Jan。在补充来源中，其组织定位、项目方向或区域协作重点可概括为：2025年4月24日 · Top international trade stories: Global trade set to decline in 2025, WTO says; Tariffs take centre stage a [2]。按源表登记，该机构关联地点为北京。","[1] World Economic Forum Annual Meeting. (n.d.). Retrieved 2026-03-25, from https://www.weforum.org/meetings/world-economic-forum-annual-meeting-2026/
[2] WTO sounds alarm on trade risks and other trade news | World …. (n.d.). Retrieved 2026-03-25, from https://www.weforum.org/stories/2025/04/global-trade-decline-2025-international-trade-stories-this-month/"
岭南（大学）学院教研发展基金有限公司（香港）广东代表处,Lingnan University School Research and Teaching Development Fund Limited (Hong Kong) – Guangdong Representative Office,非政府间组织（INGO）,教育、人才与能力建设,高等教育-学术研究,2021,广东广州,无,,暂无,暂无,"岭南（大学）学院教研发展基金有限公司（香港）广东代表处（Lingnan University School Research and Teaching Development Fund Limited (Hong Kong) – Guangdong Representative Office）成立于2021年。当前可核验来源以机构总部或权威组织资料为主，尚未稳定定位到独立的中国办公室官方主页 [1]。现有资料显示其业务或合作范围包括：2026年3月10日 · Lingnan University, founded in 1888, aspires to be a renowned research-focused liberal arts university for 。在补充来源中，其组织定位、项目方向或区域协作重点可概括为：At Lingnan, liberal arts education is achieved through the University’s broad-based curriculum, close staff-student rela [2]。按源表登记，该机构关联地点为广东广州。","[1] Lingnan University – A research-focused liberal arts university in Hong .... (n.d.). Retrieved 2026-03-25, from https://www.ln.edu.hk/
[2] About Lingnan | Lingnan University. (n.d.). Retrieved 2026-03-25, from https://www.ln.edu.hk/about-lu"
香港国际社会服务社（中国香港）广东办事处,"International Social Service Hong Kong Branch (Hong Kong, China) – Guangdong Office",非政府间组织（INGO）,社会服务、公益慈善与包容性发展,社会服务-儿童保护,2021,广东广州,无,,暂无,暂无,"香港国际社会服务社（中国香港）广东办事处（International Social Service Hong Kong Branch (Hong Kong, China) – Guangdong Office）成立于2021年。该机构主要承担跨国协作、专业网络建设或行业标准交流等职能。目前未检索到可稳定核验的中国办公室官网链接，现阶段可先将其视为以总部体系为主导开展国际合作的组织。源表登记所在地为广东广州，可作为后续人工核验线索。",暂无
G-Global 国际秘书处协会（哈萨克斯坦）海南代表处,G-Global International Secretariat Association (Kazakhstan) – Hainan Representative Office,非政府间组织（INGO）,国际交流、公共外交与民间合作,国际对话-经济合作,2021,海南海口,无,,暂无,暂无,"G-Global 国际秘书处协会（哈萨克斯坦）海南代表处（G-Global International Secretariat Association (Kazakhstan) – Hainan Representative Office）成立于2021年。当前可核验来源以机构总部或权威组织资料为主，尚未稳定定位到独立的中国办公室官方主页 [1]。现有资料显示其业务或合作范围包括：Sign in to Gmail Tip: If you sign in to a public computer, make sure to sign out before you leave the computer. Learn ho。在补充来源中，其组织定位、项目方向或区域协作重点可概括为：Official Gmail Help Center where you can find tips and tutorials on using Gmail and other answers to frequently asked qu [2]。按源表登记，该机构关联地点为海南海口。","[1] Sign in to Gmail - Computer - Gmail Help - Google Help. (n.d.). Retrieved 2026-03-25, from https://support.google.com/mail/answer/8494?hl=en&co=GENIE.Platform%3DDesktop
[2] Gmail Help. (n.d.). Retrieved 2026-03-25, from https://support.google.com/mail/?hl=en"
云安全联盟大中华区（中国香港）上海代表处,"Cloud Security Alliance Greater China Region (Hong Kong, China) – Shanghai Representative Office",非政府间组织（INGO）,数字技术、信息治理与网络安全,网络安全-行业标准,2021,上海,无,,暂无,暂无,"云安全联盟大中华区（中国香港）上海代表处（Cloud Security Alliance Greater China Region (Hong Kong, China) – Shanghai Representative Office）成立于2021年。当前可核验来源以机构总部或权威组织资料为主，尚未稳定定位到独立的中国办公室官方主页 [1]。现有资料显示其业务或合作范围包括：Blomp Account deletion on 1 month inactivity There are cloud storage providers, but this one seems like a cloud storage 。在补充来源中，其组织定位、项目方向或区域协作重点可概括为：Has adobe made it much more difficult to pirate their products? My college forces me to buy adobe dreamweaver for $20 pe [2]。按源表登记，该机构关联地点为上海。","[1] I made a huge comparison table to help you find the best cloud …. (n.d.). Retrieved 2026-03-25, from https://www.reddit.com/r/DataHoarder/comments/1aketpm/i_made_a_huge_comparison_table_to_help_you_find/
[2] Pirating adobe products : r/Piracy - Reddit. (n.d.). Retrieved 2026-03-25, from https://www.reddit.com/r/Piracy/comments/16f6grg/pirating_adobe_products/"
加拿大赣商联合会江西代表处,Canada Gan Business Federation – Jiangxi Representative Office,非政府间组织（INGO）,金融体系、治理与发展融资,侨商网络-经贸合作,2021,江西南昌,无,,暂无,暂无,"加拿大赣商联合会江西代表处（Canada Gan Business Federation – Jiangxi Representative Office）成立于2021年。当前可核验来源以机构总部或权威组织资料为主，尚未稳定定位到独立的中国办公室官方主页 [1]。现有资料显示其业务或合作范围包括：Get quick, easy access to all Government of Canada services and information.。按源表登记，该机构关联地点为江西南昌。","[1] Home - Canada .ca. (n.d.). Retrieved 2026-03-25, from https://www.canada.ca/en.html"
亚洲模特协会（韩国）重庆代表处,Asia Model Association (Korea) – Chongqing Representative Office,非政府间组织（INGO）,文化、体育与民间交流,文化产业-时尚模特,2021,重庆,无,,暂无,暂无,"亚洲模特协会（韩国）重庆代表处（Asia Model Association (Korea) – Chongqing Representative Office）成立于2021年。当前可核验来源以机构总部或权威组织资料为主，尚未稳定定位到独立的中国办公室官方主页 [1]。现有资料显示其业务或合作范围包括：Get the latest insights in media & entertainment from industry thought leaders. Check out the latest programme & happeni。在补充来源中，其组织定位、项目方向或区域协作重点可概括为：2025年12月5日 · Singapore, 12 December 2024 – Asia TV Forum & Market (ATF), Asia’s Co-Production & Entertainment Content Ma [2]。按源表登记，该机构关联地点为重庆。","[1] CONFERENCE & EVENTS - Asia TV Forum. (n.d.). Retrieved 2026-03-25, from https://www.asiatvforum.com/en-gb/conference-and-events.html
[2] An Event of - asiatvforum.com. (n.d.). Retrieved 2026-03-25, from https://www.asiatvforum.com/content/dam/sitebuilder/rxsg/atf/documents/ATF%202024%20-%2012%20December%202024%2C%20A%20milestone%20year%20with%20global%20participation%20at%20ATF%E2%80%99s%2025th%20Anniversary.pdf.coredownload.437352037.pdf"
香港会计师公会广东代表处,Hong Kong Institute of Certified Public Accountants (HKICPA) – Guangdong Representative Office,非政府间组织（INGO）,教育、人才与能力建设,经济与金融-职业认证,2021,广东广州,无,,暂无,暂无,香港会计师公会广东代表处（Hong Kong Institute of Certified Public Accountants (HKICPA) – Guangdong Representative Office）成立于2021年。该机构主要承担跨国协作、专业网络建设或行业标准交流等职能。目前未检索到可稳定核验的中国办公室官网链接，现阶段可先将其视为以总部体系为主导开展国际合作的组织。源表登记所在地为广东广州，可作为后续人工核验线索。,暂无
坦桑尼亚中国商会浙江代表处,Tanzania China Chamber of Commerce – Zhejiang Representative Office,非政府间组织（INGO）,金融体系、治理与发展融资,商会服务-经贸合作,2021,浙江义乌,无,,暂无,暂无,"坦桑尼亚中国商会浙江代表处（Tanzania China Chamber of Commerce – Zhejiang Representative Office）成立于2021年。当前可核验来源以机构总部或权威组织资料为主，尚未稳定定位到独立的中国办公室官方主页 [1]。现有资料显示其业务或合作范围包括：2025年12月10日 · FCDO travel advice for Tanzania. Includes safety and security, insurance, entry requirements and legal dif。按源表登记，该机构关联地点为浙江义乌。","[1] Tanzania travel advice - GOV.UK. (n.d.). Retrieved 2026-03-25, from https://www.gov.uk/foreign-travel-advice/tanzania"
