中文名,英文名,属性,第一细分类,第二细分类,成立年份,所在省份+城市（细）,官网,备注,官网（中国办公室）,LinkedIn（中国办公室）,中国办公室介绍（含文内引用）,参考文献（APA）
联合国工发组织投资与技术促进办公室（中国）,UNIDO Investment and Technology Promotion Office (ITPO) – China,政府间组织（IGO）,金融体系、治理与发展融资,产业投资促进-技术合作,—,北京,无,,暂无,暂无,"联合国工发组织投资与技术促进办公室（中国）（UNIDO Investment and Technology Promotion Office (ITPO) – China）成立于—年。当前可核验来源以机构总部或权威组织资料为主，尚未稳定定位到独立的中国办公室官方主页 [1]。现有资料显示其业务或合作范围包括：UNIDO, is a specialized agency in the United Nations system, headquartered in Vienna. The Organization's objective is th。按源表登记，该机构关联地点为北京。","[1] UNIDO | United Nations Industrial Development Organization. (n.d.). Retrieved 2026-03-25, from https://www.unido.org/"
联合国训练研究所CIFAL上海中心,UNITAR CIFAL Shanghai,政府间组织（IGO）,教育、人才与能力建设,能力建设-公共管理培训,—,上海,https://www.findglocal.com/CN/Shanghai/108607655094801/CIFAL-Shanghai,,https://www.findglocal.com/CN/Shanghai/108607655094801/CIFAL-Shanghai,暂无,联合国训练研究所CIFAL上海中心（UNITAR CIFAL Shanghai）成立于—年。该机构在华页面或中国相关站点中可见其中国办公室/在华合作网络的信息框架 [1]。现有资料显示其业务或合作范围包括：来自原始数据官网字段。按源表登记，该机构关联地点为上海。,"[1] 源表官网字段. (n.d.). Retrieved 2026-03-25, from https://www.findglocal.com/CN/Shanghai/108607655094801/CIFAL-Shanghai"
联合国项目事务署驻华相关办公室,United Nations Office for Project Services (UNOPS) – China,政府间组织（IGO）,公共政策、治理与能力建设,项目执行-基础设施,1995,北京,https://www.unops.org/china,,https://www.unops.org/china,暂无,联合国项目事务署驻华相关办公室（United Nations Office for Project Services (UNOPS) – China）成立于1995年。该机构在华页面或中国相关站点中可见其中国办公室/在华合作网络的信息框架 [1]。现有资料显示其业务或合作范围包括：来自原始数据官网字段。按源表登记，该机构关联地点为北京。,"[1] 源表官网字段. (n.d.). Retrieved 2026-03-25, from https://www.unops.org/china"
联合国驻华协调员办公室,United Nations Resident Coordinator Office (UNRCO) – China,政府间组织（IGO）,公共政策、治理与能力建设,联合国协调机制-发展统筹,1977,北京,https://china.un.org/en/node/189402,,https://china.un.org/en/node/189402,暂无,联合国驻华协调员办公室（United Nations Resident Coordinator Office (UNRCO) – China）成立于1977年。该机构在华页面或中国相关站点中可见其中国办公室/在华合作网络的信息框架 [1]。现有资料显示其业务或合作范围包括：来自原始数据官网字段。按源表登记，该机构关联地点为北京。,"[1] 源表官网字段. (n.d.). Retrieved 2026-03-25, from https://china.un.org/en/node/189402"
联合国大学澳门研究所,United Nations University (UNU) – Macao,政府间组织（IGO）,公共政策、治理与能力建设,高等研究-政策研究,1973,澳门,https://unu.edu/macau/contact,,暂无,暂无,联合国大学澳门研究所（United Nations University (UNU) – Macao）成立于1973年。当前可核验来源以机构总部或权威组织资料为主，尚未稳定定位到独立的中国办公室官方主页 [1]。现有资料显示其业务或合作范围包括：来自源表的机构相关网址。按源表登记，该机构关联地点为澳门。,"[1] 源表网址（待核验）. (n.d.). Retrieved 2026-03-25, from https://unu.edu/macau/contact"
联合国志愿人员组织驻华相关办公室,United Nations Volunteers (UNV) – China,政府间组织（IGO）,社会服务、公益慈善与包容性发展,志愿服务-人力支持,1970,北京,无,,暂无,暂无,联合国志愿人员组织驻华相关办公室（United Nations Volunteers (UNV) – China）成立于1970年。该机构主要承担跨国协作、专业网络建设或行业标准交流等职能。目前未检索到可稳定核验的中国办公室官网链接，现阶段可先将其视为以总部体系为主导开展国际合作的组织。源表登记所在地为北京，可作为后续人工核验线索。,暂无
世界粮食计划署驻华办公室,World Food Programme (WFP) – China Office,政府间组织（IGO）,公共政策、治理与能力建设,粮食援助-应急响应,1961,北京,无,,暂无,暂无,"世界粮食计划署驻华办公室（World Food Programme (WFP) – China Office）成立于1961年。当前可核验来源以机构总部或权威组织资料为主，尚未稳定定位到独立的中国办公室官方主页 [1]。现有资料显示其业务或合作范围包括：2026年1月23日 · The Annual Meeting 2026 of the World Economic Forum will take place at Davos-Klosters from 19th to 23rd Jan。在补充来源中，其组织定位、项目方向或区域协作重点可概括为：2025年4月24日 · Top international trade stories: Global trade set to decline in 2025, WTO says; Tariffs take centre stage a [2]。按源表登记，该机构关联地点为北京。","[1] World Economic Forum Annual Meeting. (n.d.). Retrieved 2026-03-25, from https://www.weforum.org/meetings/world-economic-forum-annual-meeting-2026/
[2] WTO sounds alarm on trade risks and other trade news | World …. (n.d.). Retrieved 2026-03-25, from https://www.weforum.org/stories/2025/04/global-trade-decline-2025-international-trade-stories-this-month/"
世界知识产权组织中国办事处,World Intellectual Property Organization (WIPO) Office in China,政府间组织（IGO）,金融体系、治理与发展融资,知识产权-创新治理,1967,北京,无,,暂无,暂无,"世界知识产权组织中国办事处（World Intellectual Property Organization (WIPO) Office in China）成立于1967年。当前可核验来源以机构总部或权威组织资料为主，尚未稳定定位到独立的中国办公室官方主页 [1]。现有资料显示其业务或合作范围包括：2026年1月23日 · The Annual Meeting 2026 of the World Economic Forum will take place at Davos-Klosters from 19th to 23rd Jan。在补充来源中，其组织定位、项目方向或区域协作重点可概括为：2025年4月24日 · Top international trade stories: Global trade set to decline in 2025, WTO says; Tariffs take centre stage a [2]。按源表登记，该机构关联地点为北京。","[1] World Economic Forum Annual Meeting. (n.d.). Retrieved 2026-03-25, from https://www.weforum.org/meetings/world-economic-forum-annual-meeting-2026/
[2] WTO sounds alarm on trade risks and other trade news | World …. (n.d.). Retrieved 2026-03-25, from https://www.weforum.org/stories/2025/04/global-trade-decline-2025-international-trade-stories-this-month/"
亚洲开发银行驻中国代表处,Asian Development Bank (ADB) – PRC Resident Mission,政府间组织（IGO）,金融体系、治理与发展融资,发展融资-基础设施,1966,北京,无,,暂无,暂无,亚洲开发银行驻中国代表处（Asian Development Bank (ADB) – PRC Resident Mission）成立于1966年。当前可核验来源以机构总部或权威组织资料为主，尚未稳定定位到独立的中国办公室官方主页 [1]。现有资料显示其业务或合作范围包括：The Asian Producers Network + Eye Catcher Global (APN+ECG) Pitching Forum presents eight (8) feature film projects from 。按源表登记，该机构关联地点为北京。,"[1] ATF x Asian Producers Network + Eye Catcher Global (APN+ECG) …. (n.d.). Retrieved 2026-03-25, from https://www.asiatvforum.com/en-gb/conference-and-events/atf-in-development-club/ATF-asian-producers-network--eye-catcher-global-apnecg-pitching-forum.html"
欧洲复兴开发银行驻华代表处,European Bank for Reconstruction and Development (EBRD) – China Office,政府间组织（IGO）,社会服务、公益慈善与包容性发展,发展融资-私营部门发展,1991,北京,无,,暂无,暂无,"欧洲复兴开发银行驻华代表处（European Bank for Reconstruction and Development (EBRD) – China Office）成立于1991年。当前可核验来源以机构总部或权威组织资料为主，尚未稳定定位到独立的中国办公室官方主页 [1]。现有资料显示其业务或合作范围包括：5 天之前 · Facts and figures on the European Union Find out how many EU Member States there are, how big the EU economy is,。按源表登记，该机构关联地点为北京。","[1] Your gateway to the EU, News, Highlights | European Union. (n.d.). Retrieved 2026-03-25, from https://european-union.europa.eu/index_en"
红十字国际委员会东亚地区代表处,International Committee of the Red Cross (ICRC) – Regional Delegation for East Asia,非政府间组织（INGO）,社会服务、公益慈善与包容性发展,人道援助-冲突救援,1863,北京,无,,暂无,暂无,红十字国际委员会东亚地区代表处（International Committee of the Red Cross (ICRC) – Regional Delegation for East Asia）成立于1863年。该机构主要承担跨国协作、专业网络建设或行业标准交流等职能。目前未检索到可稳定核验的中国办公室官网链接，现阶段可先将其视为以总部体系为主导开展国际合作的组织。源表登记所在地为北京，可作为后续人工核验线索。,暂无
国际金融公司驻中国代表处,International Finance Corporation (IFC) – China Office,政府间组织（IGO）,金融体系、治理与发展融资,私营部门投融资-发展金融,1956,北京,无,,暂无,暂无,国际金融公司驻中国代表处（International Finance Corporation (IFC) – China Office）成立于1956年。该机构主要承担跨国协作、专业网络建设或行业标准交流等职能。目前未检索到可稳定核验的中国办公室官网链接，现阶段可先将其视为以总部体系为主导开展国际合作的组织。源表登记所在地为北京，可作为后续人工核验线索。,暂无
国际货币基金组织驻华办公室,International Monetary Fund (IMF) – Beijing Resident Representative Office,政府间组织（IGO）,金融体系、治理与发展融资,经济与金融-金融稳定,1944,北京,无,,暂无,暂无,国际货币基金组织驻华办公室（International Monetary Fund (IMF) – Beijing Resident Representative Office）成立于1944年。该机构主要承担跨国协作、专业网络建设或行业标准交流等职能。目前未检索到可稳定核验的中国办公室官网链接，现阶段可先将其视为以总部体系为主导开展国际合作的组织。源表登记所在地为北京，可作为后续人工核验线索。,暂无
世界银行驻华代表处,World Bank – China Resident Mission,政府间组织（IGO）,金融体系、治理与发展融资,发展融资-减贫项目,1944,北京,无,,暂无,暂无,"世界银行驻华代表处（World Bank – China Resident Mission）成立于1944年。当前可核验来源以机构总部或权威组织资料为主，尚未稳定定位到独立的中国办公室官方主页 [1]。现有资料显示其业务或合作范围包括：2026年1月23日 · The Annual Meeting 2026 of the World Economic Forum will take place at Davos-Klosters from 19th to 23rd Jan。在补充来源中，其组织定位、项目方向或区域协作重点可概括为：2025年4月24日 · Top international trade stories: Global trade set to decline in 2025, WTO says; Tariffs take centre stage a [2]。按源表登记，该机构关联地点为北京。","[1] World Economic Forum Annual Meeting. (n.d.). Retrieved 2026-03-25, from https://www.weforum.org/meetings/world-economic-forum-annual-meeting-2026/
[2] WTO sounds alarm on trade risks and other trade news | World …. (n.d.). Retrieved 2026-03-25, from https://www.weforum.org/stories/2025/04/global-trade-decline-2025-international-trade-stories-this-month/"
中国古迹遗址保护协会,Chinese Association for the Conservation of Monuments and Sites (CACMS),非政府间组织（INGO）,文化、体育与民间交流,文化遗产保护-专业协会,1994,北京,无,,暂无,暂无,中国古迹遗址保护协会（Chinese Association for the Conservation of Monuments and Sites (CACMS)）成立于1994年。当前可核验来源以机构总部或权威组织资料为主，尚未稳定定位到独立的中国办公室官方主页 [1]。现有资料显示其业务或合作范围包括：Learn Chinese - online Mandarin Chinese courses Learn chinese with this MOOC of Mandarin Chinese. These online Chinese M。按源表登记，该机构关联地点为北京。,"[1] Home | Learn Chinese. (n.d.). Retrieved 2026-03-25, from https://learn-chinese.online/?lang=en"
国际创意与可持续发展中心,International Centre for Creativity and Sustainable Development (ICCSD),政府间组织（IGO）,文化、体育与民间交流,创意经济-可持续发展,2015,北京,无,,暂无,暂无,国际创意与可持续发展中心（International Centre for Creativity and Sustainable Development (ICCSD)）成立于2015年。该机构主要承担跨国协作、专业网络建设或行业标准交流等职能。目前未检索到可稳定核验的中国办公室官网链接，现阶段可先将其视为以总部体系为主导开展国际合作的组织。源表登记所在地为北京，可作为后续人工核验线索。,暂无
联合国教科文组织教师教育中心,Teacher Education Centre under the auspices of UNESCO (UNESCO TEC),政府间组织（IGO）,教育、人才与能力建设,教师教育-教育能力建设,2017,上海,无,,暂无,暂无,"联合国教科文组织教师教育中心（Teacher Education Centre under the auspices of UNESCO (UNESCO TEC)）成立于2017年。当前可核验来源以机构总部或权威组织资料为主，尚未稳定定位到独立的中国办公室官方主页 [1]。现有资料显示其业务或合作范围包括：1 天前 · Teachers website for latest education updates, teacher news, share and download free teaching resources, teaching。按源表登记，该机构关联地点为上海。","[1] Teacher.co.ke - Latest Education News, Free School Notes, and Revision .... (n.d.). Retrieved 2026-03-25, from https://teacher.co.ke/"
联合国教科文组织国际岩溶研究中心,International Research Center on Karst under the auspices of UNESCO (UNESCO IRCK),政府间组织（IGO）,环境、气候与可持续发展,岩溶地学-生态水文,2008,广西桂林,无,,暂无,暂无,联合国教科文组织国际岩溶研究中心（International Research Center on Karst under the auspices of UNESCO (UNESCO IRCK)）成立于2008年。该机构主要承担跨国协作、专业网络建设或行业标准交流等职能。目前未检索到可稳定核验的中国办公室官网链接，现阶段可先将其视为以总部体系为主导开展国际合作的组织。源表登记所在地为广西桂林，可作为后续人工核验线索。,暂无
联合国教科文组织全球尺度地球化学国际研究中心,International Research Centre on Global-Scale Geochemistry under the auspices of UNESCO (UNESCO ICGG),政府间组织（IGO）,环境、气候与可持续发展,地球化学-全球变化,2016,河北廊坊,无,,暂无,暂无,联合国教科文组织全球尺度地球化学国际研究中心（International Research Centre on Global-Scale Geochemistry under the auspices of UNESCO (UNESCO ICGG)）成立于2016年。该机构主要承担跨国协作、专业网络建设或行业标准交流等职能。目前未检索到可稳定核验的中国办公室官网链接，现阶段可先将其视为以总部体系为主导开展国际合作的组织。源表登记所在地为河北廊坊，可作为后续人工核验线索。,暂无
美国美中贸易全国委员会上海代表处,The US-China Business Council (USCBC) – Shanghai Representative Office,非政府间组织（INGO）,金融体系、治理与发展融资,经贸合作-政策倡议,2017,上海,无,,暂无,暂无,美国美中贸易全国委员会上海代表处（The US-China Business Council (USCBC) – Shanghai Representative Office）成立于2017年。该机构主要承担跨国协作、专业网络建设或行业标准交流等职能。目前未检索到可稳定核验的中国办公室官网链接，现阶段可先将其视为以总部体系为主导开展国际合作的组织。源表登记所在地为上海，可作为后续人工核验线索。,暂无
俄罗斯联邦工商会上海代表处,Chamber of Commerce and Industry of the Russian Federation – Shanghai Representative Office,非政府间组织（INGO）,金融体系、治理与发展融资,商会服务-经贸合作,2017,上海,无,,暂无,暂无,"俄罗斯联邦工商会上海代表处（Chamber of Commerce and Industry of the Russian Federation – Shanghai Representative Office）成立于2017年。当前可核验来源以机构总部或权威组织资料为主，尚未稳定定位到独立的中国办公室官方主页 [1]。现有资料显示其业务或合作范围包括：By joining a Chamber, you not only gain access to valuable business support and services but also become part of a vibra。在补充来源中，其组织定位、项目方向或区域协作重点可概括为：We help consumers find recommended Teignmouth businesses, services, and brands you can trust. [2]。按源表登记，该机构关联地点为上海。","[1] Find A Chamber - British Chambers of Commerce. (n.d.). Retrieved 2026-03-25, from https://www.britishchambers.org.uk/find-a-chamber/
[2] Chamber of Commerce Teignmouth, eng. (n.d.). Retrieved 2026-03-25, from https://www.chamberofcommerce.uk/business-directory/england/teignmouth/"
加拿大加中贸易理事会上海代表处,Canada China Business Council (CCBC) – Shanghai Representative Office,非政府间组织（INGO）,金融体系、治理与发展融资,贸易促进-投资合作,2017,上海,无,,暂无,暂无,"加拿大加中贸易理事会上海代表处（Canada China Business Council (CCBC) – Shanghai Representative Office）成立于2017年。当前可核验来源以机构总部或权威组织资料为主，尚未稳定定位到独立的中国办公室官方主页 [1]。现有资料显示其业务或合作范围包括：Get quick, easy access to all Government of Canada services and information.。按源表登记，该机构关联地点为上海。","[1] Home - Canada .ca. (n.d.). Retrieved 2026-03-25, from https://www.canada.ca/en.html"
世界健康基金会（美国）上海代表处,"Project HOPE (People-to-People Health Foundation, Inc.) – Shanghai Representative Office",非政府间组织（INGO）,公共卫生与全球健康,公共卫生-医疗援助,2017,上海,无,,暂无,暂无,"世界健康基金会（美国）上海代表处（Project HOPE (People-to-People Health Foundation, Inc.) – Shanghai Representative Office）成立于2017年。该机构主要承担跨国协作、专业网络建设或行业标准交流等职能。目前未检索到可稳定核验的中国办公室官网链接，现阶段可先将其视为以总部体系为主导开展国际合作的组织。源表登记所在地为上海，可作为后续人工核验线索。",暂无
应善良福利基金会（香港）上海办事处,Ying Shan Liang Welfare Foundation (Hong Kong) – Shanghai Office,非政府间组织（INGO）,社会服务、公益慈善与包容性发展,慈善公益-教育资助,2017,上海,无,,暂无,暂无,应善良福利基金会（香港）上海办事处（Ying Shan Liang Welfare Foundation (Hong Kong) – Shanghai Office）成立于2017年。该机构主要承担跨国协作、专业网络建设或行业标准交流等职能。目前未检索到可稳定核验的中国办公室官网链接，现阶段可先将其视为以总部体系为主导开展国际合作的组织。源表登记所在地为上海，可作为后续人工核验线索。,暂无
香港工业总会深圳代表处,Federation of Hong Kong Industries (FHKI) – Shenzhen Representative Office,非政府间组织（INGO）,产业发展、制造业与行业治理,产业合作-制造业网络,2017,广东深圳,无,,暂无,暂无,"香港工业总会深圳代表处（Federation of Hong Kong Industries (FHKI) – Shenzhen Representative Office）成立于2017年。当前可核验来源以机构总部或权威组织资料为主，尚未稳定定位到独立的中国办公室官方主页 [1]。现有资料显示其业务或合作范围包括：6 天之前 · About The Federation is a vibrant, thriving and ambitious communal organisation serving Orthodox Jews across the。在补充来源中，其组织定位、项目方向或区域协作重点可概括为：Asking For A Friend is a new podcast from Kehillas Federation, exploring the real questions that come up in everyday lif [2]。按源表登记，该机构关联地点为广东深圳。","[1] About – Kehillas Federation. (n.d.). Retrieved 2026-03-25, from https://www.federation.org.uk/about/
[2] Podcast – Kehillas Federation. (n.d.). Retrieved 2026-03-25, from https://www.federation.org.uk/podcast/"
香港中华厂商联合会广州代表处,The Chinese Manufacturers’ Association of Hong Kong (CMA) – Guangzhou Representative Office,非政府间组织（INGO）,金融体系、治理与发展融资,商会服务-经贸合作,2017,广东广州,无,,暂无,暂无,香港中华厂商联合会广州代表处（The Chinese Manufacturers’ Association of Hong Kong (CMA) – Guangzhou Representative Office）成立于2017年。该机构主要承担跨国协作、专业网络建设或行业标准交流等职能。目前未检索到可稳定核验的中国办公室官网链接，现阶段可先将其视为以总部体系为主导开展国际合作的组织。源表登记所在地为广东广州，可作为后续人工核验线索。,暂无
香港中华总商会广州代表处,"Chinese General Chamber of Commerce, Hong Kong (CGCC) – Guangzhou Representative Office",非政府间组织（INGO）,金融体系、治理与发展融资,商会服务-贸易投资促进,2017,广东广州,无,,暂无,暂无,"香港中华总商会广州代表处（Chinese General Chamber of Commerce, Hong Kong (CGCC) – Guangzhou Representative Office）成立于2017年。当前可核验来源以机构总部或权威组织资料为主，尚未稳定定位到独立的中国办公室官方主页 [1]。现有资料显示其业务或合作范围包括：Learn Chinese - online Mandarin Chinese courses Learn chinese with this MOOC of Mandarin Chinese. These online Chinese M。按源表登记，该机构关联地点为广东广州。","[1] Home | Learn Chinese. (n.d.). Retrieved 2026-03-25, from https://learn-chinese.online/?lang=en"
台湾贸易中心广州代表处,Taiwan External Trade Development Council (TAITRA) – Guangzhou Office,非政府间组织（INGO）,金融体系、治理与发展融资,贸易促进-展会服务,2017,广东广州,无,,暂无,暂无,"台湾贸易中心广州代表处（Taiwan External Trade Development Council (TAITRA) – Guangzhou Office）成立于2017年。当前可核验来源以机构总部或权威组织资料为主，尚未稳定定位到独立的中国办公室官方主页 [1]。现有资料显示其业务或合作范围包括：2024年1月8日 · But Taiwan sees itself as distinct from the Chinese mainland, with its own constitution and democratically-e。按源表登记，该机构关联地点为广东广州。","[1] China and Taiwan : A really simple guide - BBC. (n.d.). Retrieved 2026-03-25, from https://www.bbc.com/news/world-asia-china-59900139"
嘉里集团郭氏基金会（香港）北京代表处,Kuok Foundation (Hong Kong) – Beijing Representative Office,非政府间组织（INGO）,社会服务、公益慈善与包容性发展,慈善公益-教育支持,2017,北京,无,,暂无,暂无,嘉里集团郭氏基金会（香港）北京代表处（Kuok Foundation (Hong Kong) – Beijing Representative Office）成立于2017年。当前可核验来源以机构总部或权威组织资料为主，尚未稳定定位到独立的中国办公室官方主页 [1]。现有资料显示其业务或合作范围包括：The official website for Dua Lipa. Sign up now.。按源表登记，该机构关联地点为北京。,"[1] Dua Lipa | Official Site. (n.d.). Retrieved 2026-03-25, from https://www.dualipa.com/"
微笑列车基金会（美国）北京代表处,Smile Train – Beijing Representative Office,非政府间组织（INGO）,公共卫生与全球健康,公共卫生-儿童健康,2017,北京,http://www.smiletrainchina.org/CN/Contact.aspx?p=0,,http://www.smiletrainchina.org/CN/Contact.aspx?p=0,暂无,微笑列车基金会（美国）北京代表处（Smile Train – Beijing Representative Office）成立于2017年。该机构在华页面或中国相关站点中可见其中国办公室/在华合作网络的信息框架 [1]。现有资料显示其业务或合作范围包括：来自原始数据官网字段。按源表登记，该机构关联地点为北京。,"[1] 源表官网字段. (n.d.). Retrieved 2026-03-25, from http://www.smiletrainchina.org/CN/Contact.aspx?p=0"
