中文名,英文名,属性,第一细分类,第二细分类,成立年份,所在省份+城市（细）,官网,备注,官网（中国办公室）,LinkedIn（中国办公室）,中国办公室介绍（含文内引用）,参考文献（APA）
国际地质科学联合会,International Union of Geological Sciences,政府间组织（IGO）,科学研究与学术合作网络,地球科学-地质国际合作,1961,北京,http://en.cags.ac.cn/IC/9787.htm,,http://en.cags.ac.cn/IC/9787.htm,暂无,国际地质科学联合会（International Union of Geological Sciences）成立于1961年。该机构在华页面或中国相关站点中可见其中国办公室/在华合作网络的信息框架 [1]。现有资料显示其业务或合作范围包括：来自原始数据官网字段。按源表登记，该机构关联地点为北京。,"[1] 源表官网字段. (n.d.). Retrieved 2026-03-25, from http://en.cags.ac.cn/IC/9787.htm"
国际工程地质与环境协会,International Association of Engineering Geology and the Environment,非政府间组织（INGO）,科学研究与学术合作网络,工程地质-环境地质,1964,浙江绍兴,https://www.allconfs.org/meeting/index.asp?id=12308,,暂无,暂无,国际工程地质与环境协会（International Association of Engineering Geology and the Environment）成立于1964年。当前可核验来源以机构总部或权威组织资料为主，尚未稳定定位到独立的中国办公室官方主页 [1]。现有资料显示其业务或合作范围包括：来自源表的机构相关网址。按源表登记，该机构关联地点为浙江绍兴。,"[1] 源表网址（待核验）. (n.d.). Retrieved 2026-03-25, from https://www.allconfs.org/meeting/index.asp?id=12308"
国际糖业及综合技术专业人士协会,International Association of Professionals in Sugar and Integrated Technologies,非政府间组织（INGO）,农业、食品与乡村可持续发展,农业加工-糖业技术,2004,广西南宁,https://sugarcon2026china.com/,,https://sugarcon2026china.com/,暂无,国际糖业及综合技术专业人士协会（International Association of Professionals in Sugar and Integrated Technologies）成立于2004年。该机构在华页面或中国相关站点中可见其中国办公室/在华合作网络的信息框架 [1]。现有资料显示其业务或合作范围包括：来自原始数据官网字段。按源表登记，该机构关联地点为广西南宁。,"[1] 源表官网字段. (n.d.). Retrieved 2026-03-25, from https://sugarcon2026china.com/"
国际木材解剖学家协会,International Association of Wood Anatomists,非政府间组织（INGO）,科学研究与学术合作网络,植物科学-木材解剖,1931,北京,https://iawa-website1.org/en/News/article_259.shtml,,暂无,暂无,国际木材解剖学家协会（International Association of Wood Anatomists）成立于1931年。当前可核验来源以机构总部或权威组织资料为主，尚未稳定定位到独立的中国办公室官方主页 [1]。现有资料显示其业务或合作范围包括：来自源表的机构相关网址。按源表登记，该机构关联地点为北京。,"[1] 源表网址（待核验）. (n.d.). Retrieved 2026-03-25, from https://iawa-website1.org/en/News/article_259.shtml"
国际田间试验机械化协会,International Association on Mechanization of Field Experiments,非政府间组织（INGO）,农业、食品与乡村可持续发展,农业工程-机械化试验,1964,山东青岛,https://www.allconfs.org/meeting/list_en.asp?id=12884&nid=19211,,暂无,暂无,国际田间试验机械化协会（International Association on Mechanization of Field Experiments）成立于1964年。当前可核验来源以机构总部或权威组织资料为主，尚未稳定定位到独立的中国办公室官方主页 [1]。现有资料显示其业务或合作范围包括：来自源表的机构相关网址。按源表登记，该机构关联地点为山东青岛。,"[1] 源表网址（待核验）. (n.d.). Retrieved 2026-03-25, from https://www.allconfs.org/meeting/list_en.asp?id=12884&nid=19211"
国际成矿作用国际协会,International Association on the Genesis of Ore Deposits,非政府间组织（INGO）,科学研究与学术合作网络,地球科学-矿床地质,1964,北京,https://en.cgs.gov.cn/Cooperations/201603/t20160309_266256.html,,https://en.cgs.gov.cn/Cooperations/201603/t20160309_266256.html,暂无,国际成矿作用国际协会（International Association on the Genesis of Ore Deposits）成立于1964年。该机构在华页面或中国相关站点中可见其中国办公室/在华合作网络的信息框架 [1]。现有资料显示其业务或合作范围包括：来自原始数据官网字段。按源表登记，该机构关联地点为北京。,"[1] 源表官网字段. (n.d.). Retrieved 2026-03-25, from https://en.cgs.gov.cn/Cooperations/201603/t20160309_266256.html"
国际丝绸联盟,International Silk Union,非政府间组织（INGO）,国际经贸合作与投资促进,丝绸产业-纺织合作,2015,浙江杭州,https://www.chinasilkmuseum.com/yz/info_98_itemid_27889.html,,https://www.chinasilkmuseum.com/yz/info_98_itemid_27889.html,暂无,国际丝绸联盟（International Silk Union）成立于2015年。该机构在华页面或中国相关站点中可见其中国办公室/在华合作网络的信息框架 [1]。现有资料显示其业务或合作范围包括：来自原始数据官网字段。按源表登记，该机构关联地点为浙江杭州。,"[1] 源表官网字段. (n.d.). Retrieved 2026-03-25, from https://www.chinasilkmuseum.com/yz/info_98_itemid_27889.html"
世界工业与技术研究组织协会,World Association of Industrial and Technological Research Organizations,非政府间组织（INGO）,数字技术、信息治理与网络安全,科技创新-产业研究网络,1970,江苏南京,https://cn.linkedin.com/company/waitro,,暂无,https://cn.linkedin.com/company/waitro,"世界工业与技术研究组织协会（World Association of Industrial and Technological Research Organizations）成立于1970年。当前可核验来源以机构总部或权威组织资料为主，尚未稳定定位到独立的中国办公室官方主页 [1]。现有资料显示其业务或合作范围包括：2026年1月23日 · The Annual Meeting 2026 of the World Economic Forum will take place at Davos-Klosters from 19th to 23rd Jan。在补充来源中，其组织定位、项目方向或区域协作重点可概括为：2025年4月24日 · Top international trade stories: Global trade set to decline in 2025, WTO says; Tariffs take centre stage a [2]。按源表登记，该机构关联地点为江苏南京。","[1] World Economic Forum Annual Meeting. (n.d.). Retrieved 2026-03-25, from https://www.weforum.org/meetings/world-economic-forum-annual-meeting-2026/
[2] WTO sounds alarm on trade risks and other trade news | World …. (n.d.). Retrieved 2026-03-25, from https://www.weforum.org/stories/2025/04/global-trade-decline-2025-international-trade-stories-this-month/"
世界土壤与水保育协会,World Association of Soil and Water Conservation,非政府间组织（INGO）,环境、气候与可持续发展,环境与生态-水土保持,1983,北京,http://www.waswac.org.cn/waswac/Introduction/A5901index_1.htm,,http://www.waswac.org.cn/waswac/Introduction/A5901index_1.htm,暂无,世界土壤与水保育协会（World Association of Soil and Water Conservation）成立于1983年。该机构在华页面或中国相关站点中可见其中国办公室/在华合作网络的信息框架 [1]。现有资料显示其业务或合作范围包括：来自原始数据官网字段。按源表登记，该机构关联地点为北京。,"[1] 源表官网字段. (n.d.). Retrieved 2026-03-25, from http://www.waswac.org.cn/waswac/Introduction/A5901index_1.htm"
世界电子竞技联盟,World Esports Consortium,非政府间组织（INGO）,文化、体育与民间交流,电子竞技-行业治理,2016,北京,https://www.wescoesport.com/dgs/index.php,,暂无,暂无,世界电子竞技联盟（World Esports Consortium）成立于2016年。当前可核验来源以机构总部或权威组织资料为主，尚未稳定定位到独立的中国办公室官方主页 [1]。现有资料显示其业务或合作范围包括：来自源表的机构相关网址。按源表登记，该机构关联地点为北京。,"[1] 源表网址（待核验）. (n.d.). Retrieved 2026-03-25, from https://www.wescoesport.com/dgs/index.php"
国际科学组织联盟,Alliance of International Science Organizations,非政府间组织（INGO）,科学研究与学术合作网络,科研合作-科学组织网络,2018,北京,https://cn.linkedin.com/company/anso-alliance-of-international-science-organizations,,暂无,https://cn.linkedin.com/company/anso-alliance-of-international-science-organizations,"国际科学组织联盟（Alliance of International Science Organizations）成立于2018年。当前可核验来源以机构总部或权威组织资料为主，尚未稳定定位到独立的中国办公室官方主页 [1]。现有资料显示其业务或合作范围包括：2024年1月18日 · In an era marked by rapid technological transformation, the AI Governance Alliance – Briefing Paper Series 。按源表登记，该机构关联地点为北京。","[1] AI Governance Alliance: Briefing Paper Series 2024. (n.d.). Retrieved 2026-03-25, from https://www.weforum.org/publications/ai-governance-alliance-briefing-paper-series/"
亚太血液学联盟,Asia Pacific Hematology Consortium,非政府间组织（INGO）,公共卫生与全球健康,医学-血液学,2011,北京,https://e.bjmu.edu.cn/academicsresearch/keyinstitutes/77.htm,,https://e.bjmu.edu.cn/academicsresearch/keyinstitutes/77.htm,暂无,亚太血液学联盟（Asia Pacific Hematology Consortium）成立于2011年。该机构在华页面或中国相关站点中可见其中国办公室/在华合作网络的信息框架 [1]。现有资料显示其业务或合作范围包括：来自原始数据官网字段。按源表登记，该机构关联地点为北京。,"[1] 源表官网字段. (n.d.). Retrieved 2026-03-25, from https://e.bjmu.edu.cn/academicsresearch/keyinstitutes/77.htm"
“一带一路”税务管理合作机制,Belt and Road Initiative Tax Administration Cooperation Mechanism,政府间组织（IGO）,公共政策、治理与能力建设,税务治理-政府间合作机制,2019,北京,https://www.chinatax.gov.cn/eng/britacom-index.html,,https://www.chinatax.gov.cn/eng/britacom-index.html,暂无,“一带一路”税务管理合作机制（Belt and Road Initiative Tax Administration Cooperation Mechanism）成立于2019年。该机构在华页面或中国相关站点中可见其中国办公室/在华合作网络的信息框架 [1]。现有资料显示其业务或合作范围包括：来自原始数据官网字段。按源表登记，该机构关联地点为北京。,"[1] 源表官网字段. (n.d.). Retrieved 2026-03-25, from https://www.chinatax.gov.cn/eng/britacom-index.html"
全球气候高校联盟,Global Alliance of Universities on Climate,非政府间组织（INGO）,教育、人才与能力建设,气候变化-高校联盟,2019,北京,https://goglobal.tsinghua.edu.cn/cn/news/news.en/XCQJQPghHb,,暂无,暂无,全球气候高校联盟（Global Alliance of Universities on Climate）成立于2019年。当前可核验来源以机构总部或权威组织资料为主，尚未稳定定位到独立的中国办公室官方主页 [1]。现有资料显示其业务或合作范围包括：来自源表的机构相关网址。按源表登记，该机构关联地点为北京。,"[1] 源表网址（待核验）. (n.d.). Retrieved 2026-03-25, from https://goglobal.tsinghua.edu.cn/cn/news/news.en/XCQJQPghHb"
全球能源互联网发展合作组织,Global Energy Interconnection Development and Cooperation Organization,非政府间组织（INGO）,环境、气候与可持续发展,能源-电网互联,2016,北京,https://chinadevelopmentbrief.org/ngos/global-energy-interconnection-development-and-cooperation-organization-gei/,,暂无,暂无,全球能源互联网发展合作组织（Global Energy Interconnection Development and Cooperation Organization）成立于2016年。当前可核验来源以机构总部或权威组织资料为主，尚未稳定定位到独立的中国办公室官方主页 [1]。现有资料显示其业务或合作范围包括：来自源表的机构相关网址。按源表登记，该机构关联地点为北京。,"[1] 源表网址（待核验）. (n.d.). Retrieved 2026-03-25, from https://chinadevelopmentbrief.org/ngos/global-energy-interconnection-development-and-cooperation-organization-gei/"
国际伦理文学批评协会,International Association for Ethical Literary Criticism,非政府间组织（INGO）,科学研究与学术合作网络,文学研究-伦理批评,2012,浙江宁波,http://journal06.magtech.org.cn/Jweb3_zdsjwxkxk/CN/news/news10012.shtml,,暂无,暂无,国际伦理文学批评协会（International Association for Ethical Literary Criticism）成立于2012年。当前可核验来源以机构总部或权威组织资料为主，尚未稳定定位到独立的中国办公室官方主页 [1]。现有资料显示其业务或合作范围包括：来自源表的机构相关网址。按源表登记，该机构关联地点为浙江宁波。,"[1] 源表网址（待核验）. (n.d.). Retrieved 2026-03-25, from http://journal06.magtech.org.cn/Jweb3_zdsjwxkxk/CN/news/news10012.shtml"
国际智慧学习环境协会,International Association of Smart Learning Environments,非政府间组织（INGO）,教育、人才与能力建设,教育技术-智慧学习,无,北京,https://sli.bnu.edu.cn/English/Internationals/IASLE/index.htm,,https://sli.bnu.edu.cn/English/Internationals/IASLE/index.htm,暂无,国际智慧学习环境协会（International Association of Smart Learning Environments）成立于无年。该机构在华页面或中国相关站点中可见其中国办公室/在华合作网络的信息框架 [1]。现有资料显示其业务或合作范围包括：来自原始数据官网字段。按源表登记，该机构关联地点为北京。,"[1] 源表官网字段. (n.d.). Retrieved 2026-03-25, from https://sli.bnu.edu.cn/English/Internationals/IASLE/index.htm"
国际山茶协会,International Camellia Society,非政府间组织（INGO）,农业、食品与乡村可持续发展,园艺-植物学,1962,云南昆明,https://internationalcamellia.org/en-us/contact-us/contact-us-china,,https://internationalcamellia.org/en-us/contact-us/contact-us-china,暂无,国际山茶协会（International Camellia Society）成立于1962年。该机构在华页面或中国相关站点中可见其中国办公室/在华合作网络的信息框架 [1]。现有资料显示其业务或合作范围包括：来自原始数据官网字段。按源表登记，该机构关联地点为云南昆明。,"[1] 源表官网字段. (n.d.). Retrieved 2026-03-25, from https://internationalcamellia.org/en-us/contact-us/contact-us-china"
国际玻璃委员会,International Commission on Glass,非政府间组织（INGO）,科学研究与学术合作网络,材料科学-玻璃工程,1933,上海,https://cn.linkedin.com/company/international-commission-on-glass,,暂无,https://cn.linkedin.com/company/international-commission-on-glass,国际玻璃委员会（International Commission on Glass）成立于1933年。该机构主要承担跨国协作、专业网络建设或行业标准交流等职能。目前未检索到可稳定核验的中国办公室官网链接，现阶段可先将其视为以总部体系为主导开展国际合作的组织。源表登记所在地为上海，可作为后续人工核验线索。,暂无
国际钢铁行业分析委员会,International Committee of Analysis for Steel and Iron Industry,非政府间组织（INGO）,国际经贸合作与投资促进,冶金-钢铁检测,1992,北京,https://uia.org/s/or/en/1122276283,,暂无,暂无,国际钢铁行业分析委员会（International Committee of Analysis for Steel and Iron Industry）成立于1992年。当前可核验来源以机构总部或权威组织资料为主，尚未稳定定位到独立的中国办公室官方主页 [1]。现有资料显示其业务或合作范围包括：来自源表的机构相关网址。按源表登记，该机构关联地点为北京。,"[1] 源表网址（待核验）. (n.d.). Retrieved 2026-03-25, from https://uia.org/s/or/en/1122276283"
国际健康气功联合会,International Health Qigong Federation,非政府间组织（INGO）,文化、体育与民间交流,公共卫生-传统体育,无,北京,https://www.jendow.com.tw/wiki/國際健身氣功聯合會,,暂无,暂无,国际健康气功联合会（International Health Qigong Federation）成立于无年。当前可核验来源以机构总部或权威组织资料为主，尚未稳定定位到独立的中国办公室官方主页 [1]。现有资料显示其业务或合作范围包括：来自源表的机构相关网址。按源表登记，该机构关联地点为北京。,"[1] 源表网址（待核验）. (n.d.). Retrieved 2026-03-25, from https://www.jendow.com.tw/wiki/國際健身氣功聯合會"
国际仿生工程学会,International Society of Bionic Engineering,非政府间组织（INGO）,科学研究与学术合作网络,工程技术-仿生工程,2010,吉林长春,https://isbe-online.com/?ui=english&mod=info&act=view&id=5435,,暂无,暂无,国际仿生工程学会（International Society of Bionic Engineering）成立于2010年。当前可核验来源以机构总部或权威组织资料为主，尚未稳定定位到独立的中国办公室官方主页 [1]。现有资料显示其业务或合作范围包括：来自源表的机构相关网址。按源表登记，该机构关联地点为吉林长春。,"[1] 源表网址（待核验）. (n.d.). Retrieved 2026-03-25, from https://isbe-online.com/?ui=english&mod=info&act=view&id=5435"
国际生物材料学会联合会,International Union of Societies for Biomaterials Science and Engineering,非政府间组织（INGO）,公共卫生与全球健康,生物材料-生物医学工程,无,四川成都,https://www.iusbse.org/aboutus/,,暂无,暂无,国际生物材料学会联合会（International Union of Societies for Biomaterials Science and Engineering）成立于无年。当前可核验来源以机构总部或权威组织资料为主，尚未稳定定位到独立的中国办公室官方主页 [1]。现有资料显示其业务或合作范围包括：来自源表的机构相关网址。按源表登记，该机构关联地点为四川成都。,"[1] 源表网址（待核验）. (n.d.). Retrieved 2026-03-25, from https://www.iusbse.org/aboutus/"
中外企业家联合会,Sino-International Entrepreneurs Federation,非政府间组织（INGO）,国际经贸合作与投资促进,经贸合作-企业家网络,2008,北京,https://global.chinadaily.com.cn/a/202402/07/WS65c32427a3104efcbdaea32b.html,,暂无,暂无,中外企业家联合会（Sino-International Entrepreneurs Federation）成立于2008年。当前可核验来源以机构总部或权威组织资料为主，尚未稳定定位到独立的中国办公室官方主页 [1]。现有资料显示其业务或合作范围包括：来自源表的机构相关网址。按源表登记，该机构关联地点为北京。,"[1] 源表网址（待核验）. (n.d.). Retrieved 2026-03-25, from https://global.chinadaily.com.cn/a/202402/07/WS65c32427a3104efcbdaea32b.html"
世界政治经济学协会,World Association for Political Economy,非政府间组织（INGO）,金融体系、治理与发展融资,经济与金融-学术网络,2004,上海,https://socialistchina.org/2025/03/25/world-association-for-political-economy-call-for-papers/,,https://socialistchina.org/2025/03/25/world-association-for-political-economy-call-for-papers/,暂无,世界政治经济学协会（World Association for Political Economy）成立于2004年。该机构在华页面或中国相关站点中可见其中国办公室/在华合作网络的信息框架 [1]。现有资料显示其业务或合作范围包括：来自原始数据官网字段。按源表登记，该机构关联地点为上海。,"[1] 源表官网字段. (n.d.). Retrieved 2026-03-25, from https://socialistchina.org/2025/03/25/world-association-for-political-economy-call-for-papers/"
世界针灸学会联合会,World Federation of Acupuncture-Moxibustion Societies,非政府间组织（INGO）,公共卫生与全球健康,中医-针灸,1987,北京,https://www.findhealthclinics.com/CN/Unknown/1551122258434721/World-Federation-of-Acupuncture-Moxibustion-Societies,,暂无,暂无,世界针灸学会联合会（World Federation of Acupuncture-Moxibustion Societies）成立于1987年。当前可核验来源以机构总部或权威组织资料为主，尚未稳定定位到独立的中国办公室官方主页 [1]。现有资料显示其业务或合作范围包括：来自源表的机构相关网址。按源表登记，该机构关联地点为北京。,"[1] 源表网址（待核验）. (n.d.). Retrieved 2026-03-25, from https://www.findhealthclinics.com/CN/Unknown/1551122258434721/World-Federation-of-Acupuncture-Moxibustion-Societies"
世界中医药学会联合会,World Federation of Chinese Medicine Societies,非政府间组织（INGO）,公共卫生与全球健康,中医药-行业组织,2003,北京,https://uia.org/s/or/en/1100066696,,暂无,暂无,世界中医药学会联合会（World Federation of Chinese Medicine Societies）成立于2003年。当前可核验来源以机构总部或权威组织资料为主，尚未稳定定位到独立的中国办公室官方主页 [1]。现有资料显示其业务或合作范围包括：来自源表的机构相关网址。按源表登记，该机构关联地点为北京。,"[1] 源表网址（待核验）. (n.d.). Retrieved 2026-03-25, from https://uia.org/s/or/en/1100066696"
世界历史文化运河城市合作组织,World Historic and Cultural Canal Cities Cooperation Organization,非政府间组织（INGO）,公共政策、治理与能力建设,城市治理-文化遗产合作,2009,江苏扬州,http://belt.china.org.cn/2017-12/21/content_50175773.htm,,http://belt.china.org.cn/2017-12/21/content_50175773.htm,暂无,世界历史文化运河城市合作组织（World Historic and Cultural Canal Cities Cooperation Organization）成立于2009年。该机构在华页面或中国相关站点中可见其中国办公室/在华合作网络的信息框架 [1]。现有资料显示其业务或合作范围包括：来自原始数据官网字段。按源表登记，该机构关联地点为江苏扬州。,"[1] 源表官网字段. (n.d.). Retrieved 2026-03-25, from http://belt.china.org.cn/2017-12/21/content_50175773.htm"
世界蘑菇生物学与产品学会,World Society for Mushroom Biology and Mushroom Products,非政府间组织（INGO）,农业、食品与乡村可持续发展,农业生物-真菌学,1994,上海,https://umdis.org/photos-from-chinese-mushroom-days-and-mushroom-industry-is-going-to-make-a-proposal-to-united-nation/,,暂无,暂无,世界蘑菇生物学与产品学会（World Society for Mushroom Biology and Mushroom Products）成立于1994年。当前可核验来源以机构总部或权威组织资料为主，尚未稳定定位到独立的中国办公室官方主页 [1]。现有资料显示其业务或合作范围包括：来自源表的机构相关网址。按源表登记，该机构关联地点为上海。,"[1] 源表网址（待核验）. (n.d.). Retrieved 2026-03-25, from https://umdis.org/photos-from-chinese-mushroom-days-and-mushroom-industry-is-going-to-make-a-proposal-to-united-nation/"
世界旅游联盟,World Tourism Alliance,非政府间组织（INGO）,国际经贸合作与投资促进,旅游产业-行业合作,2017,北京,https://www2.yicaiglobal.com/news/world-tourism-alliance-sets-up-headquarters-in-china,,暂无,暂无,世界旅游联盟（World Tourism Alliance）成立于2017年。当前可核验来源以机构总部或权威组织资料为主，尚未稳定定位到独立的中国办公室官方主页 [1]。现有资料显示其业务或合作范围包括：来自源表的机构相关网址。按源表登记，该机构关联地点为北京。,"[1] 源表网址（待核验）. (n.d.). Retrieved 2026-03-25, from https://www2.yicaiglobal.com/news/world-tourism-alliance-sets-up-headquarters-in-china"
世界旅游城市联合会,World Tourism Cities Federation,非政府间组织（INGO）,公共政策、治理与能力建设,城市与建筑-地方政府交流,2012,北京,https://en.wtcf.org.cn/,,https://en.wtcf.org.cn/,暂无,世界旅游城市联合会（World Tourism Cities Federation）成立于2012年。该机构在华页面或中国相关站点中可见其中国办公室/在华合作网络的信息框架 [1]。现有资料显示其业务或合作范围包括：来自原始数据官网字段。按源表登记，该机构关联地点为北京。,"[1] 源表官网字段. (n.d.). Retrieved 2026-03-25, from https://en.wtcf.org.cn/"
船舶建造专家联盟,Active Shipbuilding Experts' Federation,非政府间组织（INGO）,物流、交通运输与供应链体系,船舶工程-行业技术网络,2015,北京,https://asef2015.com/asef-forum/4th-asef/summary-and-report/,,暂无,暂无,船舶建造专家联盟（Active Shipbuilding Experts' Federation）成立于2015年。当前可核验来源以机构总部或权威组织资料为主，尚未稳定定位到独立的中国办公室官方主页 [1]。现有资料显示其业务或合作范围包括：来自源表的机构相关网址。按源表登记，该机构关联地点为北京。,"[1] 源表网址（待核验）. (n.d.). Retrieved 2026-03-25, from https://asef2015.com/asef-forum/4th-asef/summary-and-report/"
