中文名,英文名,属性,第一细分类,第二细分类,成立年份,所在省份+城市（细）,官网,备注,官网（中国办公室）,LinkedIn（中国办公室）,中国办公室介绍（含文内引用）,参考文献（APA）
谷物与饲料贸易协会（英国）北京办事处,Agricultural Industries Confederation (UK Grain & Feed Trade Association) – Beijing Office,非政府间组织（INGO）,农业、食品与乡村可持续发展,农业贸易-谷物饲料,2017,北京,https://www.gafta.com/,,暂无,暂无,谷物与饲料贸易协会（英国）北京办事处（Agricultural Industries Confederation (UK Grain & Feed Trade Association) – Beijing Office）成立于2017年。当前可核验来源以机构总部或权威组织资料为主，尚未稳定定位到独立的中国办公室官方主页 [1]。现有资料显示其业务或合作范围包括：来自源表的机构相关网址。按源表登记，该机构关联地点为北京。,"[1] 源表网址（待核验）. (n.d.). Retrieved 2026-03-25, from https://www.gafta.com/"
落基山研究所（美国）北京代表处,Rocky Mountain Institute (RMI) – Beijing Representative Office,非政府间组织（INGO）,环境、气候与可持续发展,能源转型-低碳发展,2017,北京,https://rmi.org.cn/news/关于机构名称等相关法律权益的声明/,,暂无,暂无,落基山研究所（美国）北京代表处（Rocky Mountain Institute (RMI) – Beijing Representative Office）成立于2017年。当前可核验来源以机构总部或权威组织资料为主，尚未稳定定位到独立的中国办公室官方主页 [1]。现有资料显示其业务或合作范围包括：来自源表的机构相关网址。按源表登记，该机构关联地点为北京。,"[1] 源表网址（待核验）. (n.d.). Retrieved 2026-03-25, from https://rmi.org.cn/news/关于机构名称等相关法律权益的声明/"
一般财团法人日中经济协会（日本）北京代表处,Japan-China Economic Association – Beijing Representative Office,非政府间组织（INGO）,金融体系、治理与发展融资,经贸合作-产业交流,2017,北京,https://en.cdf.org.cn/cdf2019en/jgjs/6912.htm,,https://en.cdf.org.cn/cdf2019en/jgjs/6912.htm,暂无,一般财团法人日中经济协会（日本）北京代表处（Japan-China Economic Association – Beijing Representative Office）成立于2017年。该机构在华页面或中国相关站点中可见其中国办公室/在华合作网络的信息框架 [1]。现有资料显示其业务或合作范围包括：来自原始数据官网字段。按源表登记，该机构关联地点为北京。,"[1] 源表官网字段. (n.d.). Retrieved 2026-03-25, from https://en.cdf.org.cn/cdf2019en/jgjs/6912.htm"
中国-非洲总商会(马达加斯加）北京代表处,China-Africa Chamber of Commerce (Madagascar) – Beijing Representative Office,非政府间组织（INGO）,金融体系、治理与发展融资,经贸合作-商会服务,2017,北京,https://www.chinacheckup.com/blog/chamber-of-commerce-in-china,,暂无,暂无,中国-非洲总商会(马达加斯加）北京代表处（China-Africa Chamber of Commerce (Madagascar) – Beijing Representative Office）成立于2017年。当前可核验来源以机构总部或权威组织资料为主，尚未稳定定位到独立的中国办公室官方主页 [1]。现有资料显示其业务或合作范围包括：来自源表的机构相关网址。按源表登记，该机构关联地点为北京。,"[1] 源表网址（待核验）. (n.d.). Retrieved 2026-03-25, from https://www.chinacheckup.com/blog/chamber-of-commerce-in-china"
德国学术交流中心北京代表处,German Academic Exchange Service (DAAD) – Beijing Representative Office,非政府间组织（INGO）,教育、人才与能力建设,教育交流-奖学金,2017,北京,https://chinadevelopmentbrief.org/ngos/deutscher-akademischer-austausch-dienst-german-academic-exchange-service/,,暂无,暂无,德国学术交流中心北京代表处（German Academic Exchange Service (DAAD) – Beijing Representative Office）成立于2017年。当前可核验来源以机构总部或权威组织资料为主，尚未稳定定位到独立的中国办公室官方主页 [1]。现有资料显示其业务或合作范围包括：来自源表的机构相关网址。按源表登记，该机构关联地点为北京。,"[1] 源表网址（待核验）. (n.d.). Retrieved 2026-03-25, from https://chinadevelopmentbrief.org/ngos/deutscher-akademischer-austausch-dienst-german-academic-exchange-service/"
C40城市气候领导联盟（美国）北京代表处,C40 Cities Climate Leadership Group – Beijing Representative Office,非政府间组织（INGO）,环境、气候与可持续发展,气候变化-低碳政策,2017,北京,https://chinadevelopmentbrief.org/ngos/c40-cities-climate-leadership-group-usa-beijing-representative-office/,,暂无,暂无,C40城市气候领导联盟（美国）北京代表处（C40 Cities Climate Leadership Group – Beijing Representative Office）成立于2017年。当前可核验来源以机构总部或权威组织资料为主，尚未稳定定位到独立的中国办公室官方主页 [1]。现有资料显示其业务或合作范围包括：来自源表的机构相关网址。按源表登记，该机构关联地点为北京。,"[1] 源表网址（待核验）. (n.d.). Retrieved 2026-03-25, from https://chinadevelopmentbrief.org/ngos/c40-cities-climate-leadership-group-usa-beijing-representative-office/"
珍惜生命基金（香港）北京代表处,Treasure Life Foundation (Hong Kong) – Beijing Representative Office,非政府间组织（INGO）,社会服务、公益慈善与包容性发展,公益慈善-健康支持,2017,北京,https://www.china-briefing.com/doing-business-guide/hong-kong/company-establishment/subsidiary-vs-branch-office-vs-representative-office-in-hong-kong,,暂无,暂无,珍惜生命基金（香港）北京代表处（Treasure Life Foundation (Hong Kong) – Beijing Representative Office）成立于2017年。当前可核验来源以机构总部或权威组织资料为主，尚未稳定定位到独立的中国办公室官方主页 [1]。现有资料显示其业务或合作范围包括：来自源表的机构相关网址。按源表登记，该机构关联地点为北京。,"[1] 源表网址（待核验）. (n.d.). Retrieved 2026-03-25, from https://www.china-briefing.com/doing-business-guide/hong-kong/company-establishment/subsidiary-vs-branch-office-vs-representative-office-in-hong-kong"
加拿大中国委员会北京代表处,Canada China Council – Beijing Representative Office,非政府间组织（INGO）,金融体系、治理与发展融资,国际交流-经贸合作,2017,北京,https://www.china-briefing.com/doing-business-guide/hong-kong/company-establishment/subsidiary-vs-branch-office-vs-representative-office-in-hong-kong,,暂无,暂无,加拿大中国委员会北京代表处（Canada China Council – Beijing Representative Office）成立于2017年。当前可核验来源以机构总部或权威组织资料为主，尚未稳定定位到独立的中国办公室官方主页 [1]。现有资料显示其业务或合作范围包括：来自源表的机构相关网址。按源表登记，该机构关联地点为北京。,"[1] 源表网址（待核验）. (n.d.). Retrieved 2026-03-25, from https://www.china-briefing.com/doing-business-guide/hong-kong/company-establishment/subsidiary-vs-branch-office-vs-representative-office-in-hong-kong"
德国工业联合会北京代表处,Federation of German Industries (BDI) – Beijing Representative Office,非政府间组织（INGO）,金融体系、治理与发展融资,产业政策-经贸合作,2017,北京,https://networksdb.io/ip-addresses-of/adp-china-llc-beijing-representative-office/country/China,,暂无,暂无,德国工业联合会北京代表处（Federation of German Industries (BDI) – Beijing Representative Office）成立于2017年。当前可核验来源以机构总部或权威组织资料为主，尚未稳定定位到独立的中国办公室官方主页 [1]。现有资料显示其业务或合作范围包括：来自源表的机构相关网址。按源表登记，该机构关联地点为北京。,"[1] 源表网址（待核验）. (n.d.). Retrieved 2026-03-25, from https://networksdb.io/ip-addresses-of/adp-china-llc-beijing-representative-office/country/China"
机械制造技术协会（美国）北京办事处,Association for Manufacturing Technology (AMT) – Beijing Office,非政府间组织（INGO）,产业发展、制造业与行业治理,制造业技术-产业合作,2017,北京,https://www.mfa.gov.cn/eng/zy/jj/dstzgzz/dszs/202603/t20260305_11869240.html,,暂无,暂无,机械制造技术协会（美国）北京办事处（Association for Manufacturing Technology (AMT) – Beijing Office）成立于2017年。当前可核验来源以机构总部或权威组织资料为主，尚未稳定定位到独立的中国办公室官方主页 [1]。现有资料显示其业务或合作范围包括：来自源表的机构相关网址。按源表登记，该机构关联地点为北京。,"[1] 源表网址（待核验）. (n.d.). Retrieved 2026-03-25, from https://www.mfa.gov.cn/eng/zy/jj/dstzgzz/dszs/202603/t20260305_11869240.html"
无止桥慈善基金(香港)北京代表处,Bridge to China Charitable Foundation (Hong Kong) – Beijing Representative Office,非政府间组织（INGO）,社会服务、公益慈善与包容性发展,乡村建设-公益慈善,2017,北京,https://www.bridgetochina.org.hk/sc/about,,https://www.bridgetochina.org.hk/sc/about,暂无,无止桥慈善基金(香港)北京代表处（Bridge to China Charitable Foundation (Hong Kong) – Beijing Representative Office）成立于2017年。该机构在华页面或中国相关站点中可见其中国办公室/在华合作网络的信息框架 [1]。现有资料显示其业务或合作范围包括：来自原始数据官网字段。按源表登记，该机构关联地点为北京。,"[1] 源表官网字段. (n.d.). Retrieved 2026-03-25, from https://www.bridgetochina.org.hk/sc/about"
韩国产业研究院北京代表处,Korea Institute for Industrial Economics and Trade (KIET) – Beijing Representative Office,非政府间组织（INGO）,公共政策、治理与能力建设,产业研究-政策咨询,2017,北京,https://www.korcham-china.net/html/support/db_list.asp?flag=READ&CN_COMP_SEQ=2749,,https://www.korcham-china.net/html/support/db_list.asp?flag=READ&CN_COMP_SEQ=2749,暂无,韩国产业研究院北京代表处（Korea Institute for Industrial Economics and Trade (KIET) – Beijing Representative Office）成立于2017年。该机构在华页面或中国相关站点中可见其中国办公室/在华合作网络的信息框架 [1]。现有资料显示其业务或合作范围包括：来自原始数据官网字段。按源表登记，该机构关联地点为北京。,"[1] 源表官网字段. (n.d.). Retrieved 2026-03-25, from https://www.korcham-china.net/html/support/db_list.asp?flag=READ&CN_COMP_SEQ=2749"
爱心无国界基金会（美国）安徽代表处,Loving Without Borders Foundation (USA) – Anhui Representative Office,非政府间组织（INGO）,社会服务、公益慈善与包容性发展,儿童关爱-教育公益,2017,安徽合肥,https://www.chinagoingout.org/ngos/love-without-boundaries-foundation,,https://www.chinagoingout.org/ngos/love-without-boundaries-foundation,暂无,爱心无国界基金会（美国）安徽代表处（Loving Without Borders Foundation (USA) – Anhui Representative Office）成立于2017年。该机构在华页面或中国相关站点中可见其中国办公室/在华合作网络的信息框架 [1]。现有资料显示其业务或合作范围包括：来自原始数据官网字段。按源表登记，该机构关联地点为安徽合肥。,"[1] 源表官网字段. (n.d.). Retrieved 2026-03-25, from https://www.chinagoingout.org/ngos/love-without-boundaries-foundation"
韩国（财）全北特别自治道经济通商振兴院上海代表处,Jeonbuk Economic and Trade Promotion Agency (Korea) – Shanghai Representative Office,非政府间组织（INGO）,金融体系、治理与发展融资,经贸合作-产业促进,2017,上海,https://www.cnverify.com/report/product/1/Lion-Air-Indonesia-Limited-Guangzhou-Representative-Office,,暂无,暂无,韩国（财）全北特别自治道经济通商振兴院上海代表处（Jeonbuk Economic and Trade Promotion Agency (Korea) – Shanghai Representative Office）成立于2017年。当前可核验来源以机构总部或权威组织资料为主，尚未稳定定位到独立的中国办公室官方主页 [1]。现有资料显示其业务或合作范围包括：来自源表的机构相关网址。按源表登记，该机构关联地点为上海。,"[1] 源表网址（待核验）. (n.d.). Retrieved 2026-03-25, from https://www.cnverify.com/report/product/1/Lion-Air-Indonesia-Limited-Guangzhou-Representative-Office"
巴西出口投资促进局北京代表处,Brazilian Trade and Investment Promotion Agency (ApexBrasil) – Beijing Representative Office,非政府间组织（INGO）,金融体系、治理与发展融资,贸易促进-投资合作,2017,北京,https://www.liepin.com/job/1973359679.shtml,,暂无,暂无,巴西出口投资促进局北京代表处（Brazilian Trade and Investment Promotion Agency (ApexBrasil) – Beijing Representative Office）成立于2017年。当前可核验来源以机构总部或权威组织资料为主，尚未稳定定位到独立的中国办公室官方主页 [1]。现有资料显示其业务或合作范围包括：来自源表的机构相关网址。按源表登记，该机构关联地点为北京。,"[1] 源表网址（待核验）. (n.d.). Retrieved 2026-03-25, from https://www.liepin.com/job/1973359679.shtml"
至善社会福利基金会（台湾）云南代表处,Zhishan Social Welfare Foundation (Taiwan) – Yunnan Representative Office,非政府间组织（INGO）,社会服务、公益慈善与包容性发展,社会福利-教育支持,2017,云南丽江,https://chinadevelopmentbrief.org/ngos/zhi-shan-charitable-foundation/,,暂无,暂无,至善社会福利基金会（台湾）云南代表处（Zhishan Social Welfare Foundation (Taiwan) – Yunnan Representative Office）成立于2017年。当前可核验来源以机构总部或权威组织资料为主，尚未稳定定位到独立的中国办公室官方主页 [1]。现有资料显示其业务或合作范围包括：来自源表的机构相关网址。按源表登记，该机构关联地点为云南丽江。,"[1] 源表网址（待核验）. (n.d.). Retrieved 2026-03-25, from https://chinadevelopmentbrief.org/ngos/zhi-shan-charitable-foundation/"
苗圃行动(中国香港)云南办事处,"Sowers Action (Hong Kong, China) – Yunnan Office",非政府间组织（INGO）,教育、人才与能力建设,教育公益-乡村教育,2017,云南昆明,https://chinadevelopmentbrief.org/ngos/sowers-action/,,暂无,暂无,"苗圃行动(中国香港)云南办事处（Sowers Action (Hong Kong, China) – Yunnan Office）成立于2017年。当前可核验来源以机构总部或权威组织资料为主，尚未稳定定位到独立的中国办公室官方主页 [1]。现有资料显示其业务或合作范围包括：来自源表的机构相关网址。按源表登记，该机构关联地点为云南昆明。","[1] 源表网址（待核验）. (n.d.). Retrieved 2026-03-25, from https://chinadevelopmentbrief.org/ngos/sowers-action/"
加拿大牛肉国际协会上海代表处,Canada Beef International Institute – Shanghai Representative Office,非政府间组织（INGO）,农业、食品与乡村可持续发展,农业贸易-肉类产业,2017,上海,https://mfood-beverage.jiagle.com/company-company-profile-1244178/,,暂无,暂无,加拿大牛肉国际协会上海代表处（Canada Beef International Institute – Shanghai Representative Office）成立于2017年。当前可核验来源以机构总部或权威组织资料为主，尚未稳定定位到独立的中国办公室官方主页 [1]。现有资料显示其业务或合作范围包括：来自源表的机构相关网址。按源表登记，该机构关联地点为上海。,"[1] 源表网址（待核验）. (n.d.). Retrieved 2026-03-25, from https://mfood-beverage.jiagle.com/company-company-profile-1244178/"
日本国际贸易促进协会北京代表处,Japan International Trade Promotion Association – Beijing Representative Office,非政府间组织（INGO）,金融体系、治理与发展融资,经贸合作-贸易促进,2017,北京,https://www.globaltimes.cn/page/202202/1253163.shtml,,暂无,暂无,日本国际贸易促进协会北京代表处（Japan International Trade Promotion Association – Beijing Representative Office）成立于2017年。当前可核验来源以机构总部或权威组织资料为主，尚未稳定定位到独立的中国办公室官方主页 [1]。现有资料显示其业务或合作范围包括：来自源表的机构相关网址。按源表登记，该机构关联地点为北京。,"[1] 源表网址（待核验）. (n.d.). Retrieved 2026-03-25, from https://www.globaltimes.cn/page/202202/1253163.shtml"
传仁基金会（美国）云南办事处,Compassion Foundation (USA) – Yunnan Office,非政府间组织（INGO）,教育、人才与能力建设,教育公益-儿童发展,2017,云南昆明,无,,暂无,暂无,"传仁基金会（美国）云南办事处（Compassion Foundation (USA) – Yunnan Office）成立于2017年。当前可核验来源以机构总部或权威组织资料为主，尚未稳定定位到独立的中国办公室官方主页 [1]。现有资料显示其业务或合作范围包括：2 天之前 · Compassion literally means “to suffer together.” Among emotion researchers, it is defined as the feeling that ar。在补充来源中，其组织定位、项目方向或区域协作重点可概括为：2026年2月27日 · Compassion literally means “to suffer together.” Among emotion researchers, it is defined as the feeling th [2]。按源表登记，该机构关联地点为云南昆明。","[1] Compassion Definition | What Is Compassion - Greater Good. (n.d.). Retrieved 2026-03-25, from https://greatergood.berkeley.edu/topic/compassion/definition
[2] Compassion | Greater Good. (n.d.). Retrieved 2026-03-25, from https://greatergood.berkeley.edu/topic/compassion"
智行基金会（香港）河南代表处,Chi Heng Foundation (Hong Kong) – Henan Representative Office,非政府间组织（INGO）,社会服务、公益慈善与包容性发展,教育与艾滋关怀-儿童支持,2017,河南郑州,https://chinadevelopmentbrief.org/ngos/chi-heng-foundation/,,暂无,暂无,智行基金会（香港）河南代表处（Chi Heng Foundation (Hong Kong) – Henan Representative Office）成立于2017年。当前可核验来源以机构总部或权威组织资料为主，尚未稳定定位到独立的中国办公室官方主页 [1]。现有资料显示其业务或合作范围包括：来自源表的机构相关网址。按源表登记，该机构关联地点为河南郑州。,"[1] 源表网址（待核验）. (n.d.). Retrieved 2026-03-25, from https://chinadevelopmentbrief.org/ngos/chi-heng-foundation/"
亚洲动物基金有限公司（中国香港）四川办事处,"Animals Asia Foundation (Hong Kong, China) – Sichuan Office",非政府间组织（INGO）,环境、气候与可持续发展,动物保护-野生动物救助,2017,四川成都,https://chinadevelopmentbrief.org/ngos/animals-in-asia/,,暂无,暂无,"亚洲动物基金有限公司（中国香港）四川办事处（Animals Asia Foundation (Hong Kong, China) – Sichuan Office）成立于2017年。当前可核验来源以机构总部或权威组织资料为主，尚未稳定定位到独立的中国办公室官方主页 [1]。现有资料显示其业务或合作范围包括：来自源表的机构相关网址。按源表登记，该机构关联地点为四川成都。","[1] 源表网址（待核验）. (n.d.). Retrieved 2026-03-25, from https://chinadevelopmentbrief.org/ngos/animals-in-asia/"
荷兰贸易促进委员会成都代表处,Netherlands Trade Promotion Council (NTP) – Chengdu Representative Office,非政府间组织（INGO）,金融体系、治理与发展融资,贸易促进-经贸合作,2017,四川成都,https://ncbc.nl/about-ncbc/,,暂无,暂无,荷兰贸易促进委员会成都代表处（Netherlands Trade Promotion Council (NTP) – Chengdu Representative Office）成立于2017年。当前可核验来源以机构总部或权威组织资料为主，尚未稳定定位到独立的中国办公室官方主页 [1]。现有资料显示其业务或合作范围包括：来自源表的机构相关网址。按源表登记，该机构关联地点为四川成都。,"[1] 源表网址（待核验）. (n.d.). Retrieved 2026-03-25, from https://ncbc.nl/about-ncbc/"
日本公益财团法人岩手产业振兴中心大连代表处,Iwate Industrial Promotion Center (Japan) – Dalian Representative Office,非政府间组织（INGO）,金融体系、治理与发展融资,产业振兴-投资促进,2017,辽宁大连,无,,暂无,暂无,"日本公益财团法人岩手产业振兴中心大连代表处（Iwate Industrial Promotion Center (Japan) – Dalian Representative Office）成立于2017年。当前可核验来源以机构总部或权威组织资料为主，尚未稳定定位到独立的中国办公室官方主页 [1]。现有资料显示其业务或合作范围包括：Morioka City has landed on The New York Times’ “52 Places to Go in 2023” for its walkability, lack of crowds, and buildi。按源表登记，该机构关联地点为辽宁大连。","[1] Morioka, the capital of Iwate Prefecture, has made The New York Times .... (n.d.). Retrieved 2026-03-25, from https://visitiwate.com/en/article/7206"
日本公益财团法人富山国际中心大连代表处,Toyama International Center (Japan) – Dalian Representative Office,非政府间组织（INGO）,金融体系、治理与发展融资,国际交流-经贸合作,2017,辽宁大连,无,,暂无,暂无,日本公益财团法人富山国际中心大连代表处（Toyama International Center (Japan) – Dalian Representative Office）成立于2017年。该机构主要承担跨国协作、专业网络建设或行业标准交流等职能。目前未检索到可稳定核验的中国办公室官网链接，现阶段可先将其视为以总部体系为主导开展国际合作的组织。源表登记所在地为辽宁大连，可作为后续人工核验线索。,暂无
荷兰贸易促进委员会南京代表处,Netherlands Trade Promotion Council (NTP) – Nanjing Representative Office,非政府间组织（INGO）,金融体系、治理与发展融资,贸易促进-投资合作,2017,江苏南京,https://listings.echinacities.com/nanjing/detail/8933-Netherlands-Business-Support-Office-Nanjing,,暂无,暂无,荷兰贸易促进委员会南京代表处（Netherlands Trade Promotion Council (NTP) – Nanjing Representative Office）成立于2017年。当前可核验来源以机构总部或权威组织资料为主，尚未稳定定位到独立的中国办公室官方主页 [1]。现有资料显示其业务或合作范围包括：来自源表的机构相关网址。按源表登记，该机构关联地点为江苏南京。,"[1] 源表网址（待核验）. (n.d.). Retrieved 2026-03-25, from https://listings.echinacities.com/nanjing/detail/8933-Netherlands-Business-Support-Office-Nanjing"
法国国际展览业协会上海代表处,"Global Association of the Exhibition Industry (UFI, France) – Shanghai Representative Office",非政府间组织（INGO）,金融体系、治理与发展融资,会展产业-行业标准,2017,上海,无,,暂无,暂无,"法国国际展览业协会上海代表处（Global Association of the Exhibition Industry (UFI, France) – Shanghai Representative Office）成立于2017年。当前可核验来源以机构总部或权威组织资料为主，尚未稳定定位到独立的中国办公室官方主页 [1]。现有资料显示其业务或合作范围包括：On-air, on Global Player and outdoor. Through these platforms combined, we entertain and reach over 51 million individua。在补充来源中，其组织定位、项目方向或区域协作重点可概括为：Global Media Group Services Limited is part of the Global Media & Entertainment Group, the parent company of which is Gl [2]。按源表登记，该机构关联地点为上海。","[1] Global | Leading UK media company offering radio and outdoor …. (n.d.). Retrieved 2026-03-25, from https://global.com/
[2] About | Culture | Company | Team | Global. (n.d.). Retrieved 2026-03-25, from https://global.com/about/"
加拿大猪肉国际协会上海代表处,Canada Pork International – Shanghai Representative Office,非政府间组织（INGO）,农业、食品与乡村可持续发展,农业贸易-猪肉产业,2017,上海,https://china.usembassy-china.org.cn/zh/embassy-consulates-zh/shanghai-zh/,,暂无,暂无,加拿大猪肉国际协会上海代表处（Canada Pork International – Shanghai Representative Office）成立于2017年。当前可核验来源以机构总部或权威组织资料为主，尚未稳定定位到独立的中国办公室官方主页 [1]。现有资料显示其业务或合作范围包括：来自源表的机构相关网址。按源表登记，该机构关联地点为上海。,"[1] 源表网址（待核验）. (n.d.). Retrieved 2026-03-25, from https://china.usembassy-china.org.cn/zh/embassy-consulates-zh/shanghai-zh/"
