中文名,英文名,属性,行动领域,细分行动领域,成立年份,所在地,官网,微信公众号,LinkedIn,机构介绍,参考资料
智利水果出口商协会上海代表处,Chilean Fruit Exporters Association – Shanghai Representative Office,非政府间组织（INGO）,农业、食品与乡村可持续发展,农产品贸易-市场推广,2020,上海,无,,暂无,,
百万圆桌（美国）上海代表处,"Million Dollar Round Table (MDRT, USA) – Shanghai Representative Office",非政府间组织（INGO）,教育、人才与能力建设,经济与金融-职业发展,2020,上海,无,,暂无,,
匈牙利工业园委员会中国部湖北办事处,Hungarian Industrial Park Council – China Division Hubei Office,非政府间组织（INGO）,国际经贸合作与投资促进,产业园区-投资促进,2020,湖北武汉,无,,暂无,,
美国全球中小企业联盟杭州代表处,Global SME Alliance (USA) – Hangzhou Representative Office,非政府间组织（INGO）,创新创业与科技转化,中小企业发展-创业创新,2020,浙江杭州,无,,暂无,,
国际精神分析协会（英国）武汉代表处,"International Psychoanalytical Association (IPA, UK) – Wuhan Representative Office",非政府间组织（INGO）,公共卫生、医学与生命科学,心理健康-学术交流,2020,湖北武汉,无,,暂无,,
新加坡中华总商会四川代表处,Singapore Chinese Chamber of Commerce & Industry (SCCCI) – Sichuan Representative Office,非政府间组织（INGO）,金融体系、治理与发展融资,商会服务-经贸合作,2020,四川成都,无,,暂无,,
澳门妇女联合总会广东办事处,Macau Women’s General Association – Guangdong Office,非政府间组织（INGO）,社会服务、公益慈善与包容性发展,妇女发展-社会服务,2020,广东珠海,无,,暂无,,
新西兰中国国际贸易促进委员会上海代表处,New Zealand China Council for the Promotion of International Trade – Shanghai Representative Office,非政府间组织（INGO）,金融体系、治理与发展融资,贸易促进-投资合作,2020,上海,无,,暂无,,
智利华商联合总会上海代表处,Chilean Chinese Merchants Federation – Shanghai Representative Office,非政府间组织（INGO）,金融体系、治理与发展融资,侨商网络-经贸合作,2020,上海,无,,暂无,,
土木工程师学会（英国）北京代表处,"Institution of Civil Engineers (ICE, UK) – Beijing Representative Office",非政府间组织（INGO）,产业发展、制造业与行业治理,土木工程-专业认证,2020,北京,无,,暂无,,
俄罗斯联邦工商会北京代表处,Chamber of Commerce and Industry of the Russian Federation – Beijing Representative Office,非政府间组织（INGO）,金融体系、治理与发展融资,商会服务-经贸合作,2020,北京,无,,暂无,,
波兰中国商会天津代表处,Poland-China Chamber of Commerce – Tianjin Representative Office,非政府间组织（INGO）,金融体系、治理与发展融资,商会服务-经贸合作,2020,天津,无,,暂无,,
加拿大湖北商会武汉代表处,Canada Hubei Chamber of Commerce – Wuhan Representative Office,非政府间组织（INGO）,金融体系、治理与发展融资,商会服务-经贸合作,2021,湖北武汉,无,,暂无,,
世界福州十邑同乡总会有限公司（香港）福州办事处,World Fuzhou Shiyi Tongxiang Association Limited (Hong Kong) – Fuzhou Office,非政府间组织（INGO）,国际交流、公共外交与民间合作,侨务社团-联谊互助,2021,福建福州,无,,暂无,,
德国机床制造商协会上海代表处,German Machine Tool Builders’ Association (VDW) – Shanghai Representative Office,非政府间组织（INGO）,产业发展、制造业与行业治理,机床制造-工业合作,2021,上海,无,,暂无,,
泰国中华总商会汕头代表处,Thai Chinese Chamber of Commerce – Shantou Representative Office,非政府间组织（INGO）,金融体系、治理与发展融资,商会服务-经贸合作,2021,广东汕头,无,,暂无,,
柬埔寨国际商会湖北代表处,Cambodia International Chamber of Commerce – Hubei Representative Office,非政府间组织（INGO）,金融体系、治理与发展融资,商会服务-经贸合作,2021,湖北武汉,无,,暂无,,
泰国广西总商会广西办事处,Thailand Guangxi General Chamber of Commerce – Guangxi Office,非政府间组织（INGO）,金融体系、治理与发展融资,商会服务-经贸合作,2021,广西柳州,无,,暂无,,
巴拿马华商总会广东办事处,Panama Chinese Merchants Association – Guangdong Office,非政府间组织（INGO）,金融体系、治理与发展融资,侨商网络-经贸合作,2021,广东清远,无,,暂无,,
世界自由贸易区联合会（美国）杭州代表处,"World Free Zones Organization (WFZO, USA) – Hangzhou Representative Office",非政府间组织（INGO）,国际法、仲裁与规则治理,自由贸易区-投资促进,2021,浙江杭州,无,,暂无,,
国际行动理事会（爱尔兰）北京代表处,International Action Council (Ireland) – Beijing Representative Office,非政府间组织（INGO）,公共政策、治理与能力建设,国际政策-对话合作,2021,北京,无,,暂无,,
毛里求斯经济发展局上海代表处,Economic Development Board of Mauritius (EDB Mauritius) – Shanghai Representative Office,非政府间组织（INGO）,金融体系、治理与发展融资,投资促进-经贸合作,2021,上海,无,,暂无,,
美国加州葡萄干管理委员会上海代表处,California Raisin Administrative Committee (USA) – Shanghai Representative Office,非政府间组织（INGO）,农业、食品与乡村可持续发展,农产品推广-市场合作,2021,上海,无,,暂无,,
美国啤酒酿造商协会上海代表处,Beer Institute (USA) – Shanghai Representative Office,非政府间组织（INGO）,农业、食品与乡村可持续发展,酒类产业-行业协会,2021,上海,无,,暂无,,
美国威斯康辛州花旗参农业总会上海代表处,Wisconsin Ginseng Association (USA) – Shanghai Representative Office,非政府间组织（INGO）,农业、食品与乡村可持续发展,农产品推广-品牌营销,2021,上海,无,,暂无,,
美国稻米协会上海代表处,USA Rice – Shanghai Representative Office,非政府间组织（INGO）,农业、食品与乡村可持续发展,农产品贸易-市场推广,2021,上海,无,,暂无,,
美国马铃薯协会上海代表处,Potatoes USA – Shanghai Representative Office,非政府间组织（INGO）,农业、食品与乡村可持续发展,农产品推广-市场合作,2021,上海,无,,暂无,,
美国乳品出口协会上海代表处,U.S. Dairy Export Council (USDEC) – Shanghai Representative Office,非政府间组织（INGO）,金融体系、治理与发展融资,乳品贸易-市场推广,2021,上海,无,,暂无,,
柬埔寨国际商会浙江代表处,Cambodia International Chamber of Commerce – Zhejiang Representative Office,非政府间组织（INGO）,数字技术、信息治理与网络安全,商会服务-经贸合作,2021,浙江湖州,无,,暂无,,
南非-中国跨境电商协会上海代表处,South Africa–China Cross-Border E-Commerce Association – Shanghai Representative Office,非政府间组织（INGO）,金融体系、治理与发展融资,跨境电商-贸易促进,2021,上海,无,,暂无,,
老挝国家工商会重庆代表处,Lao National Chamber of Commerce and Industry – Chongqing Representative Office,非政府间组织（INGO）,创新创业与科技转化,商会服务-经贸合作,2021,重庆,无,,暂无,,
法中经贸企业和科技创新促进会上海代表处,France–China Economic and Trade Enterprises & Science and Technology Innovation Promotion Association – Shanghai Representative Office,非政府间组织（INGO）,金融体系、治理与发展融资,经贸合作-科技创新,2021,上海,无,,暂无,,
俄中商务中心（俄罗斯）上海代表处,Russia–China Business Center (Russia) – Shanghai Representative Office,非政府间组织（INGO）,金融体系、治理与发展融资,经贸合作-商务服务,2021,上海,无,,暂无,,
欧盟广西总商会（德国）广西联络处,European Union Guangxi General Chamber of Commerce (Germany) – Guangxi Liaison Office,非政府间组织（INGO）,金融体系、治理与发展融资,商会服务-经贸合作,2021,广西南宁,无,,暂无,,
世界内镜医师协会（美国）北京代表处,World Endoscopy Doctors Association (USA) – Beijing Representative Office,非政府间组织（INGO）,公共卫生、医学与生命科学,医学学会-专业培训,2021,北京,无,,暂无,,
岭南（大学）学院教研发展基金有限公司（香港）广东代表处,Lingnan University School Research and Teaching Development Fund Limited (Hong Kong) – Guangdong Representative Office,非政府间组织（INGO）,教育、人才与能力建设,高等教育-学术研究,2021,广东广州,无,,暂无,,
香港国际社会服务社（中国香港）广东办事处,"International Social Service Hong Kong Branch (Hong Kong, China) – Guangdong Office",非政府间组织（INGO）,社会服务、公益慈善与包容性发展,社会服务-儿童保护,2021,广东广州,无,,暂无,,
G-Global 国际秘书处协会（哈萨克斯坦）海南代表处,G-Global International Secretariat Association (Kazakhstan) – Hainan Representative Office,非政府间组织（INGO）,国际交流、公共外交与民间合作,国际对话-经济合作,2021,海南海口,无,,暂无,,
云安全联盟大中华区（中国香港）上海代表处,"Cloud Security Alliance Greater China Region (Hong Kong, China) – Shanghai Representative Office",非政府间组织（INGO）,数字技术、信息治理与网络安全,网络安全-行业标准,2021,上海,无,,暂无,,
加拿大赣商联合会江西代表处,Canada Gan Business Federation – Jiangxi Representative Office,非政府间组织（INGO）,金融体系、治理与发展融资,侨商网络-经贸合作,2021,江西南昌,无,,暂无,,
亚洲模特协会（韩国）重庆代表处,Asia Model Association (Korea) – Chongqing Representative Office,非政府间组织（INGO）,文化、体育与民间交流,文化产业-时尚模特,2021,重庆,无,,暂无,,
香港会计师公会广东代表处,Hong Kong Institute of Certified Public Accountants (HKICPA) – Guangdong Representative Office,非政府间组织（INGO）,教育、人才与能力建设,经济与金融-职业认证,2021,广东广州,无,,暂无,,
坦桑尼亚中国商会浙江代表处,Tanzania China Chamber of Commerce – Zhejiang Representative Office,非政府间组织（INGO）,金融体系、治理与发展融资,商会服务-经贸合作,2021,浙江义乌,无,,暂无,,
格鲁吉亚对外贸易联合会上海代表处,Georgia Foreign Trade Federation – Shanghai Representative Office,非政府间组织（INGO）,金融体系、治理与发展融资,经贸合作-贸易促进,2021,上海,无,,暂无,,
世界舞蹈总会宁夏代表处,World Dance Council – Ningxia Representative Office,非政府间组织（INGO）,文化、体育与民间交流,舞蹈艺术-赛事活动,2021,宁夏银川,无,,暂无,,
波尔多葡萄酒行业联合委员会（法国）上海代表处,"Bordeaux Wine Council (CIVB, France) – Shanghai Representative Office",非政府间组织（INGO）,农业、食品与乡村可持续发展,葡萄酒产业-贸易推广,2021,上海,无,,暂无,,
汽车经理人协会（德国）湖北代表处,Automotive Executives Association (Germany) – Hubei Representative Office,非政府间组织（INGO）,产业发展、制造业与行业治理,汽车产业-管理交流,2021,湖北武汉,无,,暂无,,
香港青年学生动力基金有限公司广东办事处,Hong Kong Youth Student Development Foundation Limited – Guangdong Office,非政府间组织（INGO）,教育、人才与能力建设,青年发展-教育交流,2021,广东中山,无,,暂无,,
新西兰湖北商业总会湖北代表处,New Zealand Hubei Business Association – Hubei Representative Office,非政府间组织（INGO）,金融体系、治理与发展融资,商会服务-经贸合作,2021,湖北武汉,无,,暂无,,
美国西部农业贸易协会上海代表处,Western United States Agricultural Trade Association – Shanghai Representative Office,非政府间组织（INGO）,农业、食品与乡村可持续发展,农业贸易-市场推广,2021,上海,无,,暂无,,
国际铝业协会（英国）北京代表处,International Aluminium Institute (UK) – Beijing Representative Office,非政府间组织（INGO）,产业发展、制造业与行业治理,金属工业-产业研究,2021,北京,无,,暂无,,
韩国束草商工会议所珲春代表处,Sokcho Chamber of Commerce and Industry (Korea) – Hunchun Representative Office,非政府间组织（INGO）,金融体系、治理与发展融资,商会服务-经贸合作,2021,吉林珲春,无,,暂无,,
日本内容产品海外流通促进机构北京代表处,"Content Overseas Distribution Association (CODA, Japan) – Beijing Representative Office",非政府间组织（INGO）,国际法、仲裁与规则治理,文化产业-版权保护,2021,北京,无,,暂无,,
非洲中国合作与发展协会（摩洛哥）重庆代表处,Africa–China Cooperation and Development Association (Morocco) – Chongqing Representative Office,非政府间组织（INGO）,教育、人才与能力建设,经贸合作-发展交流,2021,重庆,无,,暂无,,
国际微无创医学会（新加坡）重庆代表处,International Society of Micro-Invasive Medicine (Singapore) – Chongqing Representative Office,非政府间组织（INGO）,公共卫生、医学与生命科学,医学学术-医疗技术,2021,重庆,无,,暂无,,
国际辣椒联盟文化协会（意大利）重庆代表处,International Chili Alliance Cultural Association (Italy) – Chongqing Representative Office,非政府间组织（INGO）,农业、食品与乡村可持续发展,农业食品-文化推广,2021,重庆,无,,暂无,,
亚太运输资产保护协会（新加坡）上海代表处,Asia-Pacific Transport Asset Protection Association (Singapore) – Shanghai Representative Office,非政府间组织（INGO）,物流、交通运输与供应链体系,物流安全-供应链管理,2021,上海,无,,暂无,,
澳门爱国教育青年协会广东办事处,Macau Patriotic Education Youth Association – Guangdong Office,非政府间组织（INGO）,文化、体育与民间交流,青年教育-文化交流,2021,广东江门,无,,暂无,,
哥伦比亚国家咖啡生产者协会上海代表处,National Federation of Coffee Growers of Colombia – Shanghai Representative Office,非政府间组织（INGO）,农业、食品与乡村可持续发展,农产品贸易-品牌推广,2021,上海,无,,暂无,,
澳亚商会（澳大利亚）上海代表处,AusAsia Chamber of Commerce (Australia) – Shanghai Representative Office,非政府间组织（INGO）,金融体系、治理与发展融资,商会服务-投资促进,2021,上海,无,,暂无,,
罗马尼亚工商联合会上海代表处,Romanian Chamber of Commerce and Industry – Shanghai Representative Office,非政府间组织（INGO）,金融体系、治理与发展融资,商会服务-经贸合作,2021,上海,无,,暂无,,
法国粮食行业协会北京办事处,French Grain Industry Association – Beijing Office,非政府间组织（INGO）,农业、食品与乡村可持续发展,农业粮食-贸易推广,2021,北京,无,,暂无,,
一般社团法人日本湖北总商会湖北代表处,Japan Hubei General Chamber of Commerce – Hubei Representative Office,非政府间组织（INGO）,金融体系、治理与发展融资,商会服务-经贸合作,2021,湖北武汉,无,,暂无,,
澳大利亚湖北商会湖北代表处,Australia Hubei Chamber of Commerce – Hubei Representative Office,非政府间组织（INGO）,金融体系、治理与发展融资,商会服务-经贸合作,2021,湖北武汉,无,,暂无,,
国际戏剧协会（法国）上海代表处,International Theatre Institute (France) – Shanghai Representative Office,非政府间组织（INGO）,文化、体育与民间交流,戏剧艺术-文化交流,2021,上海,无,,暂无,,
气候组织（英国）北京代表处,The Climate Group (UK) – Beijing Representative Office,非政府间组织（INGO）,环境、气候与可持续发展,气候变化-低碳政策,2021,北京,无,,暂无,,
国际力量举联合会（卢森堡）北京代表处,International Powerlifting Federation (Luxembourg) – Beijing Representative Office,非政府间组织（INGO）,文化、体育与民间交流,体育组织-赛事管理,2021,北京,无,,暂无,,
TIC国际检验检测认证理事会（比利时）上海代表处,TIC Council (Belgium) – Shanghai Representative Office,非政府间组织（INGO）,国际法、仲裁与规则治理,检验检测-认证标准,2022,上海,无,,暂无,,
葡萄酒与烈酒教育基金会（英国）上海代表处,"Wine & Spirit Education Trust (WSET, UK) – Shanghai Representative Office",非政府间组织（INGO）,教育、人才与能力建设,职业教育-酒类培训,2022,上海,无,,暂无,,
塞尔维亚商会上海代表处,Chamber of Commerce of Serbia – Shanghai Representative Office,非政府间组织（INGO）,金融体系、治理与发展融资,商会服务-经贸合作,2022,上海,无,,暂无,,
法国番禺富善社广东代表处,French Panyu Fushan Association – Guangdong Representative Office,非政府间组织（INGO）,文化、体育与民间交流,文化交流-侨团联谊,2022,广东广州,无,,暂无,,
艾伦·麦克阿瑟基金会（英国）北京代表处,Ellen MacArthur Foundation (UK) – Beijing Representative Office,非政府间组织（INGO）,环境、气候与可持续发展,循环经济-可持续发展,2022,北京,https://www.theconsumergoodsforum.com/blog/2025/10/01/cgf-china-day-2025-charting-a-course-for-a-sustainable-and-innovative-consumer-goods-future-in-china/,,暂无,,
克林顿健康发展组织（美国）海南代表处,Clinton Health Access Initiative (USA) – Hainan Representative Office,非政府间组织（INGO）,公共卫生、医学与生命科学,公共卫生-医疗援助,2022,海南海口,无,,暂无,,
香港会计师公会北京代表处,Hong Kong Institute of Certified Public Accountants – Beijing Representative Office,非政府间组织（INGO）,教育、人才与能力建设,经济与金融-职业认证,2022,北京,无,,暂无,,
国际滑雪联合会（瑞士）北京代表处,"International Ski Federation (FIS, Switzerland) – Beijing Representative Office",非政府间组织（INGO）,文化、体育与民间交流,体育组织-冰雪运动,2022,北京,无,,暂无,,
俄罗斯晋商总商会山西代表处,Russia Shanxi Merchants General Chamber of Commerce – Shanxi Representative Office,非政府间组织（INGO）,金融体系、治理与发展融资,商会服务-经贸合作,2022,山西太原,无,,暂无,,
格鲁吉亚一带一路商务馆广州代表处,Georgia Belt and Road Business Center – Guangzhou Representative Office,非政府间组织（INGO）,金融体系、治理与发展融资,经贸合作-投资促进,2022,广东广州,无,,暂无,,
树华教育基金会（美国）北京代表处,Treehua Education Foundation (USA) – Beijing Representative Office,非政府间组织（INGO）,教育、人才与能力建设,教育公益-奖学金,2022,北京,无,,暂无,,
法国国家乳制品行业协会北京代表处,National Dairy Industry Association of France – Beijing Representative Office,非政府间组织（INGO）,农业、食品与乡村可持续发展,乳制品产业-贸易推广,2022,北京,无,,暂无,,
全球甲醇行业协会（新加坡）北京代表处,Global Methanol Industry Association (Singapore) – Beijing Representative Office,非政府间组织（INGO）,环境、气候与可持续发展,能源化工-行业研究,2022,北京,无,,暂无,,
中国缅甸经济合作发展促进会（缅甸）重庆代表处,China–Myanmar Economic Cooperation and Development Promotion Association (Myanmar) – Chongqing Representative Office,非政府间组织（INGO）,国际经贸合作与投资促进,经贸合作-区域发展,2022,重庆,无,,暂无,,
香港华侨华人总商会浙江代表处,Hong Kong Overseas Chinese General Chamber of Commerce – Zhejiang Representative Office,非政府间组织（INGO）,金融体系、治理与发展融资,侨商网络-经贸合作,2022,浙江杭州,无,,暂无,,
全美浙江总商会浙江办事处,Zhejiang General Chamber of Commerce of America – Zhejiang Office,非政府间组织（INGO）,金融体系、治理与发展融资,商会服务-投资合作,2022,浙江杭州,无,,暂无,,
尼日利亚企业家协会义乌代表处,Nigerian Entrepreneurs Association – Yiwu Representative Office,非政府间组织（INGO）,国际经贸合作与投资促进,中非贸易-企业合作,2022,浙江义乌,无,,暂无,,
海内外华人华侨联合会（中国香港）江苏代表处,"Overseas Chinese Federation (Hong Kong, China) – Jiangsu Representative Office",非政府间组织（INGO）,国际交流、公共外交与民间合作,侨团组织-联谊互助,2022,江苏连云港,无,,暂无,,
香港中华工商总会上海代表处,Hong Kong Chinese General Chamber of Commerce – Shanghai Representative Office,非政府间组织（INGO）,金融体系、治理与发展融资,商会服务-经贸合作,2022,上海,无,,暂无,,
禧福乐华有限公司（中国香港）河南代表处,"CFLH Company Limited (Hong Kong, China) – Henan Representative Office",非政府间组织（INGO）,社会服务、公益慈善与包容性发展,公益服务-社会发展,2022,河南周口,无,,暂无,,
国际母乳会（美国）重庆代表处,La Leche League International (USA) – Chongqing Representative Office,非政府间组织（INGO）,公共卫生、医学与生命科学,母婴健康-家庭支持,2022,重庆,无,,暂无,,
德国德中协会浙江联络处,German–Chinese Association (Germany) – Zhejiang Liaison Office,非政府间组织（INGO）,国际经贸合作与投资促进,双边交流-经贸合作,2022,浙江杭州,无,,暂无,,
欧洲血液和骨髓移植协会基金会（荷兰）上海代表处,European Society for Blood and Marrow Transplantation Foundation (Netherlands) – Shanghai Representative Office,非政府间组织（INGO）,公共卫生、医学与生命科学,医学研究-医疗合作,2022,上海,无,,暂无,,
普罗维植国际植物饮食协会（美国）上海代表处,Plant-Based Diet Association International (USA) – Shanghai Representative Office,非政府间组织（INGO）,公共卫生、医学与生命科学,健康饮食-营养推广,2022,上海,无,,暂无,,
太平洋地区发展与教育组织（美国）上海代表处,Pacific Region Development and Education Organization (USA) – Shanghai Representative Office,非政府间组织（INGO）,教育、人才与能力建设,教育发展-能力建设,2022,上海,无,,暂无,,
泰中东盟经贸促进会（泰国）吉林代表处,Thailand–China ASEAN Trade and Economic Promotion Association – Jilin Representative Office,非政府间组织（INGO）,国际经贸合作与投资促进,经贸合作-区域发展,2022,吉林长春,无,,暂无,,
澳门中华总商会广东办事处,Macau Chinese General Chamber of Commerce – Guangdong Office,非政府间组织（INGO）,国际经贸合作与投资促进,商会服务-经贸合作,2022,广东珠海,无,,暂无,,
老挝国家工商会广州代表处,Lao National Chamber of Commerce and Industry – Guangzhou Representative Office,非政府间组织（INGO）,国际经贸合作与投资促进,商会服务-经贸合作,2022,广东广州,无,,暂无,,
亚太医疗技术协会（新加坡）北京代表处,"Asia Pacific Medical Technology Association (APACMed, Singapore) – Beijing Representative Office",非政府间组织（INGO）,公共卫生、医学与生命科学,医疗器械-行业政策,2022,北京,无,,暂无,,
法国国家干邑行业管理局北京代表处,"Bureau National Interprofessionnel du Cognac (BNIC, France) – Beijing Representative Office",非政府间组织（INGO）,国际法、仲裁与规则治理,酒类产业-原产地保护,2022,北京,无,,暂无,,
法国国家葡萄酒及烈酒委员会北京代表处,French Wine and Spirits Council – Beijing Representative Office,非政府间组织（INGO）,产业发展、制造业与行业治理,葡萄酒烈酒-行业管理,2022,北京,无,,暂无,,
中法教育交流协会(法国)河南代表处,Sino-French Education Exchange Association (France) – Henan Representative Office,非政府间组织（INGO）,教育、人才与能力建设,教育交流-文化合作,2022,河南郑州,无,,暂无,,
非洲青年经贸合作组织（利比里亚）河南代表处,African Youth Economic and Trade Cooperation Organization (Liberia) – Henan Representative Office,非政府间组织（INGO）,国际经贸合作与投资促进,青年创业-经贸合作,2022,河南郑州,无,,暂无,,
世界研学旅游组织（加拿大）河南代表处,World Study Travel Organization (Canada) – Henan Representative Office,非政府间组织（INGO）,教育、人才与能力建设,研学旅游-教育实践,2022,河南洛阳,无,,暂无,,
国际奥艺委员会（瑞士）北京代表处,International Olympic Art Committee (Switzerland) – Beijing Representative Office,非政府间组织（INGO）,文化、体育与民间交流,体育文化-艺术推广,2022,北京,无,,暂无,,
美国华盛顿州中美贸易促进会浙江办事处,Washington State China–US Trade Promotion Association (USA) – Zhejiang Office,非政府间组织（INGO）,国际经贸合作与投资促进,经贸促进-投资合作,2022,浙江杭州,无,,暂无,,
